Title,Topic,Date,Content,Link,Image,Tag
สภาการพยาบาล ท้วง สธ.ขยายอายุ วัคซีนไฟเซอร์ ห่วงกระทบประชาชน,ข่าวโควิด-19,"7 ก.พ. 2566
-
13:55 น.","สภาการพยาบาล ทำหนังสือท้วง สธ. หวั่นขยายอายุวัคซีนไฟเซอร์จาก 9 เดือน เป็น 15 เดือน จากเดิมมี 8 รุ่น หมดอายุ 30 ก.ย.65 เป็น 30 มี.ค.66 อย.แจงยึดหลักวิชาการ
วันที่ 7 ก.พ. ผู้สื่อข่าวรายงานว่า รศ.ดร.สุจิตรา เหลืองอมรเลิศ นายกสภาการพยาบาล ได้ทำหนังสือลงวันที่ 31 ม.ค. 2566 เรื่องขอทักท้วงการกำหนดอายุวัคซีน 15 เดือนสำหรับวัคซีน Comirnaty เลขทะเบียน IC 8/64 (NBC) ส่งถึงปลัดกระทรวงสาธารณสุข (สธ.) ระบุว่า สำนักงานคณะกรรมการอาหารและยา (อย.) ขยายอายุผลิตภัณฑ์วัคซีน บริษัท ไฟเซอร์ กำหนดวันหมดอายุผลิตภัณฑ์วัคซีน Comirnaty (Concentrate for dispersion for injection) สูตรตำรับ PBS/Sucrose buffer 30 ug จากสถานที่ผลิต BioNTech ประเทศเยอรมัน จำนวน 8 รุ่นการผลิต ปริมาณนำเข้าทั้งสิ้น 4,891,524 โดส ซึ่งเป็นรุ่นการผลิตที่ปล่อยผ่านจากสถานที่ผลิตแล้ว จากเดิมอายุยา 9 เดือน (วันหมดอายุ 30 ก.ย. 2565) เป็น 15 เดือน (วันหมดอายุ 30 มี.ค. 2566 ) เมื่อเก็บรักษาที่อุณหภูมิ -60 ถึง -90 องศาเซลเซียส หากไม่พบการเบี่ยงเบนอุณหภูมิออกนอกช่วงสภาวะการเก็บรักษาตามที่ได้รับอนุมัติจาก อย.
สภาการพยาบาล ได้นำเรื่องดังกล่าวหารือในที่ประชุมภาคีสภาวิชาชีพด้านสุขภาพ ครั้งที่ 1/2566 เมื่อวันที่ 10 ม.ค. 2566 มีมติให้สภาการพยาบาลทำหนังสือทักท้วงเพื่อขอให้ อย.ทบทวนกรณีดังกล่าว เนื่องจากเกรงว่าวัคซีนที่หมดอายุ ที่ได้รับการขยายอายุผลิตภัณฑ์และนำไปฉีดให้แก่ประชาชน อาจจะเกิดผลกระทบต่อสุขภาพของประชาชน และเกิดผลกระทบต่อภาพลักษณ์องค์กรได้ เนื่องจากร้อยละ 80 เป็นพยาบาลวิชาชีพที่เป็นผู้ฉีดวัคซีนดังกล่าว หากฉีดไปแล้วจะเกิดความไม่สบายใจ จึงได้ทำหนังสือทักท้วงมายัง สธ.เพื่อหาแนวทางปฏิบัติที่ชัดเจนต่อไป
ด้าน นพ.ไพศาล ดั่นคุ้ม เลขาธิการ อย. กล่าวว่า การขยายอายุวัคซีนไฟเซอร์ จาก 9 เดือน เป็น 15 เดือน เป็นการพิจารณาจากข้อมูลวิชาการที่ผู้ได้รับอนุญาตนำข้อมูลความปลอดภัยจากผู้ผลิตวัคซีน มายื่นขอขยายอายุการใช้งาน ซึ่งหากมีการเก็บในอุณหภูมิคงที่ -60 องศาเซลเซียส โดยเนื้อวัคซีนไม่ปนสิ่งแปลกปลอมหรือสภาพเปลี่ยนไป ก็สามารถนำมาใช้ได้ ทั้งนี้ วัคซีนถือเป็นยา ซึ่งตามปกติจะมีการระบุวันหมดอายุไว้ แต่หากมีข้อมูลความไม่ปลอดภัยก็สามารถนำมาพิจารณาระงับการใช้หรือเรียกคืนในล็อตที่มีปัญหาได้
เมื่อถามกรณีวัคซีนที่ขยายอายุจะหมดอายุวันที่ 30 มี.ค. นี้ อาจส่งผลกระทบต่อผู้รับวัคซีนและภาพลักษณ์ของสภาการพยาบาล เพราะ 80% ของผู้ที่ฉีดวัคซีน คือพยาบาล นพ.ไพศาล กล่าวว่า สำหรับเรื่องนี้เราต้องคุยกันด้วยหลักวิชาการ ซึ่งตอนนี้วัคซีนไฟเซอร์ยังไม่พบปัญหาใดๆ ในการใช้งาน แม้ว่าจะมีการยืดอายุออกเป็น 15 เดือน ทั้งนี้ หากหน่วยงานใดมีข้อมูลว่าพบปัญหาก็ขอให้ส่งมาที่ อย.",https://www.khaosod.co.th/covid-19/news_7497130,https://www.khaosod.co.th/wpapp/uploads/2023/02/%E0%B8%A7%E0%B8%B1%E0%B8%84%E0%B8%8B%E0%B8%B5%E0%B8%99%E0%B9%82%E0%B8%84%E0%B8%A7%E0%B8%B4%E0%B8%94-300x169.jpg,"ไฟเซอร์ , วัคซีนโควิด , โควิด , สภาการพยาบาล , "
'หมอยง' เผยชัด โควิด End Game ไม่ต้องฉีดวัคซีนทุก 4-6 เดือน เหลือเเค่ปีละครั้ง,ข่าวโควิด-19,"6 ก.พ. 2566
-
11:09 น.","‘หมอยง’ เผยชัด โควิด End Game ความรุนแรงโรคลดลงโดยตลอด ไม่จำเป็นต้องฉีดวัคซีนทุก 4-6 เดือน เหลือเพียงแค่ปีละครั้ง ในช่วง เม.ย.-พ.ค.
วันที่ 6 ก.พ.2566 ศ.นพ.ยง ภู่วรวรรณ หัวหน้าศูนย์เชี่ยวชาญเฉพาะทางด้านไวรัสวิทยาคลินิก ภาควิชากุมารเวชศาสตร์ คณะแพทยศาสตร์ จุฬาลงกรณ์มหาวิทยาลัย โพสต์ข้อความผ่านทางเฟซบุ๊ก Yong Poovorawan เรื่อง โควิด 19 end game โดยเข้าสู่โรคประจำฤดูกาล ความว่า โรคโควิด 19 ไม่ได้หายไปไหน และน่าจะสิ้นสุดด้วยการเปลี่ยนเป็นโรคประจำฤดูกาลต่อไป
ในปีที่ 4 นี้ การนับยอดผู้ป่วยติดเชื้อ ไม่เกิดประโยชน์ เพราะตัวเลขที่รายงานต่ำกว่าความเป็นจริงมาก ขณะนี้ทั่วโลกน่าจะมีการติดเชื้อมากกว่าร้อยละ 70 หรือประมาณ 5 พันล้านคน ตัวเลขที่รายงานการติดเชื้อทั่วโลกมีประมาณเกือบ 700 ล้านคน ต่ำกว่าความเป็นจริงประมาณ 10 เท่า ประเทศไทยก็ไม่ได้รายงานตัวเลขติดเชื้อแล้ว รายงานเฉพาะผู้ป่วยที่ต้องรับไว้รักษาในโรงพยาบาลและผู้เสียชีวิตเท่านั้น
องค์การอนามัยโลกคงจะเลิกนับตัวเลขในเร็วๆนี้ หลังจากการระบาดในประเทศจีนลดลง (เพราะส่วนใหญ่ติดเชื้อแล้ว)
ความรุนแรงของโรคลดลงมาโดยตลอด ผู้เสียชีวิตมากกว่าร้อยละ 80 เป็นผู้สูงอายุ และมีโรคประจำตัว จะไม่มีการย้อนไปปิดบ้านปิดเมืองอีกแล้ว
วัคซีน โดยเฉพาะ mRNA ตลาดควรเป็นของผู้ซื้อ วัคซีนมีอายุสั้น และขวดหนึ่ง ยังมีจำนวน 7-10 โดส จึงยากต่อการใช้ ให้มีการสูญเสียทิ้งให้น้อยที่สุด ประกอบกับมีราคาแพง มีอาการแทรกซ้อนที่พบได้ มากกว่าวัคซีนที่ใช้ในอดีต และในอนาคตเมื่อเทียบกับความรุนแรงของโรค จึงเป็นการยากที่ประเทศกำลังพัฒนาเข้าถึง
ความจำเป็นที่จะต้องฉีดทุก 4-6 เดือนไม่มีอีกแล้ว เมื่อเข้าสู่โรคประจำฤดูกาล การให้วัคซีนจะเหลือปีละ 1 ครั้ง การนัดคนมาฉีดพร้อมกันเพื่อลดการสูญเสียของวัคซีนจะทำได้ยากขึ้น โดยเฉพาะวัคซีนมีอายุสั้น การเก็บรักษายุ่งยาก ใช้อุณหภูมิติดลบ ยิ่งทำให้ราคาแพงขึ้น การให้ได้วัคซีนตรงกับสายพันธุ์ยิ่งยากเข้าไปอีก เพราะการพัฒนาต้องมีต้นทุนสูงและเมื่อพัฒนาขึ้นมาแล้วไวรัสก็เปลี่ยนสายพันธุ์ไปอีก
ในอนาคตอันใกล้นี้ก็น่าจะได้เห็นตัวเลขของประเทศที่ใช้วัคซีนต่างชนิดกัน ประสิทธิภาพในการลดความรุนแรง หรือเสียชีวิตเป็นอย่างไร เมื่อทุกประเทศส่วนใหญ่ติดเชื้อไปหมดแล้ว จะเป็นการย้อนดูบทเรียนในอดีต
ประเทศไทยมีการติดเชื้อไปแล้วมากกว่าร้อยละ 70 ถึงวันนี้ น่าจะถึงร้อยละ 80 ทำให้มีภูมิต้านทานแบบธรรมชาติร่วมกับภูมิต้านทานจากวัคซีน ในประชากรเกือบทั้งหมด และถ้าจำเป็นต้องฉีดวัคซีนปีละ 1 ครั้ง โดยให้ในกลุ่มเสี่ยง ปริมาณวัคซีนที่ใช้ต่อปี ก็จะเหมือนไข้หวัดใหญ่ ที่มีฤดูกาลระบาดในฤดูฝนหรือโรงเรียนเปิดเทอมแรก ในเดือนมิถุนายนนั่นเอง
การให้วัคซีนประจำปี ก็ควรจะเป็น เดือนเมษายน – พฤษภาคม เพื่อป้องกันการระบาดในฤดูฝน ที่จะเริ่มตั้งแต่เดือนมิถุนายน",https://www.khaosod.co.th/covid-19/news_7494370,https://www.khaosod.co.th/wpapp/uploads/2023/02/%E0%B8%AB%E0%B8%A1%E0%B8%AD%E0%B8%A2%E0%B8%87-%E0%B9%82%E0%B8%84%E0%B8%A7%E0%B8%B4%E0%B8%94-300x169.jpg,-
อนามัยโลกชี้โควิด-19 ยังเป็น “ภาวะฉุกเฉินด้านสาธารณสุข” ยอดดับพุ่งทั่วโลก,รอบโลก,"31 ม.ค. 2566
-
14:00 น.","อนามัยโลกชี้โควิด-19 ยังเป็น “ภาวะฉุกเฉินด้านสาธารณสุข” ยอดดับพุ่งทั่วโลก
อนามัยโลกชี้โควิด-19 – ซินหัว รายงานว่า องค์การอนามัยโลก (WHO) ประกาศว่าการระบาดใหญ่ของโรคติดเชื้อไวรัสโคโรนาสายพันธุ์ใหม่หรือ โควิด-19 ยังเป็น ภาวะฉุกเฉินด้านสาธารณสุขระหว่างประเทศ (PHEIC) ซึ่งเป็นระดับการเฝ้าระวังสูงสุด ท่ามกลางจำนวนผู้เสียชีวิตรายสัปดาห์ที่เพิ่มขึ้นทั่วโลก และส่งผลให้ยอดผู้เสียชีวิตสะสมมีอย่างน้อย 6.76 ล้านราย
คณะกรรมการฉุกเฉินด้านกฎอนามัยระหว่างประเทศ ขององค์การอนามัยโลก ประกาศว่าโรคโควิด-19 ยังคงถือเป็นภาวะฉุกเฉินด้านสาธารณสุขระหว่างประเทศ หลังการประชุมประเมินการแพร่ระบาดของโควิด-19 รายไตรมาสเมื่อวันศุกร์ที่ 27 ม.ค. ซึ่งได้รับการเห็นพ้องจาก นายแพทย์ทีโดรส อัดฮานอม กีบรีเยซุส ผู้อำนวยการใหญ่องค์การอนามัยโลก
FILE PHOTO: Director-General of the World Health Organisation (WHO) Dr. Tedros Adhanom Ghebreyesus attends a briefing on global health issues in Geneva, Switzerland, December 14, 2022. REUTERS/Denis Balibouse/File Photo
คณะกรรมการระบุในแถลงการณ์ว่า โรคโควิด-19 ยังคงเป็นโรคติดเชื้อที่อันตรายและสามารถสร้างความเสียหายอย่างใหญ่หลวงต่อระบบสาธารณสุข พร้อมยอมรับว่าการระบาดของโควิด-19 มีแนวโน้มกำลังเข้าใกล้จุดเปลี่ยนผ่าน
แม้การติดเชื้อหรือการฉีดวัคซีนอาจนำไปสู่ระดับภูมิคุ้มกันของประชากรทั่วโลกที่สูงขึ้นและบรรเทาผลกระทบของอาการป่วยและการเสียชีวิต ทว่าเชื้อไวรัสนี้อาจยังคงเป็นเชื้อก่อโรคในมนุษย์และสัตว์อย่างถาวรในอนาคตอันใกล้ พร้อมเรียกร้องการดำเนินการด้านสาธารณสุขในระยะยาวที่มุ่งบรรเทาผลกระทบของโรคโควิด-19 ต่ออาการป่วยและการเสียชีวิต
ขณะเดียวกันยังแนะนำประเทศต่างๆ ให้บรรลุเป้าหมายการฉีดวัคซีนให้ครอบคลุมประชากรกลุ่มสำคัญ ปรับปรุงการรายงานข้อมูลการเฝ้าระวังเชื้อไวรัสต่อองค์การอนามัยโลก ตลอดจนเตรียมพร้อมดำเนินมาตรการตอบโต้ทางการแพทย์ในระยะยาว เช่น การฉีดวัคซีน การวินิจฉัย และการรักษาโรค
The World Health Organization (WHO) said on Monday that the COVID-19 pandemic still constitutes a Public Health Emergency of International Concern (PHEIC), the WHO’s highest alert level. In a list of temporary recommendations, Tedros said countries should continue vaccinating people and incorporate Covid-19 vaccines into routine care; improve disease surveillance; maintain a strong health care system to avoid a “a panic-neglect cycle”; continue to fight misinformation; and adjust international travel measures based on risk assessment. (Xinhua)
FILE PHOTO: A nurse prepares a shot for Jonathan Halter as the German embassy begins its roll out of BioNTech COVID-19 vaccines for German expatriates at a Beijing United Family hospital in Beijing, China. Covid-19 remains a global health emergency, the World Health Organization said on Monday, but it acknowledged the pandemic is at a “transition point.” REUTERS/Thomas Peter/File Photo
 ข่าวที่เกี่ยวข้อง:
จีนโวสังเวยโควิด “ลดฮวบ” เกือบ 80% ส่งสัญญาณดี-อัตราติดเชื้อส่อต่ำลง",https://www.khaosod.co.th/covid-19/news_7484902,https://www.khaosod.co.th/wpapp/uploads/2023/01/COVIDstillinthealthemergency-02-300x169.jpg,-
