Title,Topic,Date,Content,Link,Image,Tag
ก้าวไกล ติวเข้มผู้สมัคร ตั้งเป้าได้ส.ส.เขตครบทุกภาค ย้ำเปิดพื้นที่รับมือผู้เห็นต่าง,การเมือง,"15 มี.ค. 2566
-
14:26 น.","ก้าวไกล อบรมว่าที่ผู้สมัครทั่วประเทศ เตรียมตัวก่อนยุบสภา ตั้งเป้ามี ส.ส.เขตทั่วทุกภาค ย้ำเปิดพื้นที่รับมือผู้เห็นต่าง ไม่ปล่อยให้เป็นเหมือน ป้านา บ้านโป่ง
เมื่อวันที่ 15 มี.ค.2566 ที่โรงแรมเอเชีย แอร์พอร์ต พรรคก้าวไกล จัดสัมมนาอบรมว่าที่ผู้สมัคร ส.ส. เพื่อเตรียมตัวก่อนยุบสภา ซึ่งเน้นย้ำยุทธศาสตร์การหาเสียงโค้งสุดท้าย และแคมเปญหาเสียง รวมทั้งปลุกขวัญและกำลังใจว่าที่ผู้สมัคร
นายพิธา ลิ้มเจริญรัตน์ หัวหน้าพรรคก้าวไกล กล่าวว่า อยากพิสูจน์ว่า 4 ปีในการทำหน้าที่ฝ่ายค้าน หากเป็นรัฐบาลจะมีประโยชน์มากกว่า จึงต้องเตรียมความพร้อมในการทำงานเอาไว้ พรรคก้าวไกล วางเป้าหมายว่าต้องได้จำนวนส.ส.ทั้งแบบแบ่งเขตและบัญชีรายชื่อ มากกว่าพรรคอนาคตใหม่ และได้ ส.ส.เขตครบทุกภาค ซึ่งขณะนี้ได้เตรียมว่าที่ผู้สมัครพร้อมแล้ว เหลือเพียง 10 เขต
ส่วนนายธนาธร จึงรุ่งเรืองกิจ ประธานคณะก้าวหน้า และแกนนำคณะก้าวหน้า จะมามีส่วนร่วมช่วยพรรคดีเบตหรือไม่ นายพิธา กล่าวว่า ต้องเป็นไปตามกฎหมาย คือเป็นผู้ช่วยหาเสียง
เมื่อถามว่ากรณีมีคนเข้าไปวุ่นวายระหว่างการหาเสียง จะรับมืออย่างไร นายพิธา กล่าวว่า พรรคก้าวไกลเข้าใจ ถือเป็นส่วนหนึ่งของระบอบประชาธิปไตย และสิทธิในการแสดงออก แต่ต้องมีกระบวนการจัดการ
แต่หากมีคนเข้ามาป่วนในงานหาเสียง รับประกันได้ว่า จะไม่ทำให้พวกตนเสียสมาธิ และจะไม่ทำเหมือนที่เกิดกับป้านา ที่จ.ราชบุรีอย่างแน่นอน ไม่ว่าตอนหาเสียงหรือตอนที่ตนเป็นรัฐบาลแล้ว เพราะเราต้องการให้เกิดพื้นที่ปลอดภัยและพื้นที่พูดคุย ซึ่งถือเป็นส่วนหนึ่งของประชาธิปไตย แต่ต้องดูว่ามาด้วยความตั้งใจใช้สิทธิ์ทางการเมืองจริง หรือมีความตั้งใจอื่นแอบแฝง เชื่อว่าทุกคนน่าจะดูออก",https://www.khaosod.co.th/politics/news_7560434,https://www.khaosod.co.th/wpapp/uploads/2023/03/%E0%B8%9E%E0%B8%B4%E0%B8%98%E0%B8%B2-3-300x169.jpg,"เลือกตั้ง66 , พิธา ลิ้มเจริญรัตน์ , ก้าวไกล , "
ชื่นมื่น! อนุทิน-ศักดิ์สยาม-ชาดา เข้าพบ บิ๊กป้อม ที่ป่ารอยต่อ ร่วมทานมื้อกลางวัน,การเมือง,"15 มี.ค. 2566
-
14:05 น.","ชื่นมื่น! “อนุทิน-ศักดิ์สยาม-ชาดา” ขอเข้าพบ ร่วมรับประทานอาหารกลางวันกับ บิ๊กป้อม ที่มูลนิธิป่ารอยต่อฯ บรรยากาศเป็นกันเอง
เมื่อเวลา 12.00 น. วันที่ 15 มี.ค. 2566 ที่มูลนิธิอนุรักษ์ป่ารอยต่อ 5 จังหวัด นายอนุทิน ชาญวีรกูล รองนายกรัฐมนตรี และรมว.สาธารณสุข นายศักดิ์สยาม ชิดชอบ รมว.คมนาคม พร้อมด้วย นายชาดา ไทยเศรษฐ์ ส.ส.อุทัยธานี พรรคภูมิใจไทย (ภท.) ได้เข้าพบและร่วมรับประทานอาหารกับ พล.อ.ประวิตร วงษ์สุวรรณ รองนายกฯ และหัวหน้าพรรคพลังประชารัฐ (พปชร.)
ผู้สื่อข่าวรายงานว่า ได้มีการรับประทานอาหารกลางวันร่วมกัน และพูดคุยกันในหลายๆ เรื่องๆ บรรยากาศในการพูดคุยมีความเป็นกันเอง และเป็นไปด้วยความชื่นมื่น พล.อ.ประวิตร มีสีหน้ายิ้มแย้มและอารมณ์ดี
โดยการพบปะครั้งนี้มีขึ้นภายหลังพล.อ.ประวิตร เป็นประธานการประชุมผ่านระบบวีดีโอคอนเฟอเรนซ์ ภายในห้องประชุมมูลนิธิอนุรักษ์ป่ารอยต่อ 5 จังหวัด กับคณะกรรมการสิ่งแวดล้อมแห่งชาติ และคณะกรรมการแร่แห่งชาติ โดยหลังจากประชุมเสร็จในช่วงเวลาเที่ยง นายอนุทิน นายศักดิ์สยาม และนายชาดา ได้เข้าพบพูดคุยและรับประทานอาหารร่วมกัน ก่อนขอตัวกลับ",https://www.khaosod.co.th/politics/news_7560371,https://www.khaosod.co.th/wpapp/uploads/2023/03/%E0%B8%9B%E0%B9%89%E0%B8%AD%E0%B8%A1%E0%B8%81%E0%B8%B4%E0%B8%99%E0%B8%82%E0%B9%89%E0%B8%B2%E0%B8%A7-300x169.jpg,"ศักดิ์สยาม ชิดชอบ” , ประวิตร วงษ์สุวรรณ , ชาดา ไทยเศรษฐ์ , อนุทิน ชาญวีรกูล , "
นอท กองสลากพลัส แจงใช้โลโก้ใหม่ พรรคเปลี่ยน หลังประชุมใหญ่สัปดาห์หน้า,การเมือง,"15 มี.ค. 2566
-
13:38 น.","นอท กองสลากพลัส แจงเปลี่ยนโลโก้ ‘พรรคเปลี่ยน’ เหตุของเดิมคล้ายพรรคก้าวไกล ยอมรับเป็นข้อบกพร่อง เตรียมใช้หลังประชุมใหญ่สัปดาห์หน้า
วันที่ 15 มี.ค.2566 ผู้สื่อข่าวรายงานว่า นายพันธ์ธวัช นาควิสุทธิ์ หรือ นอท กองสลากพลัส หัวหน้าพรรคเปลี่ยน โพสต์ผ่านเพจ นอท พันธ์ธวัช นาควิสุทธิ์ ระบุว่า ก่อนอื่นผมต้องขออภัย พรรคก้าวไกล ในเรื่องโลโก้เดิมที่ผมออกแบบไว้ แต่คิดน้อยไปหน่อยเลยทำให้โลโก้เดิมไปคล้ายกับโลโก้ของพรรคก้าวไกล
แต่ผมขอยืนยันว่าตอนออกแบบ ผมไม่ได้คิดถึงพรรคก้าวไกลเลย ผมคิดถึงแต่ “หัวลูกศร และ ปอปลา” ซึ่งเป็นความบกพร่องของผมเอง ผมยอมรับผิด
ต่อมาเมื่อ คุณรังสิมันต์ โรม ออกมาติงเรื่องนี้ ผมเองก็ได้นำกลับไปคิดและเห็นด้วยกับทุกคนว่ามันไม่ควร ผมจึงตัดสินใจออกแบบใหม่ทันที ตรงนี้ต้องขอบคุณคุณรังสิมันต์ด้วยครับ สำหรับคำแนะนำทางด้านการเมือง
โลโก้พรรคใหม่นี้ เราจะเปลี่ยนและใช้หลังจากประชุมใหญ่แล้วในสัปดาห์หน้า
ผู้สื่อข่าวรายงานว่า โลโก้ใหม่ของพรรคเปลี่ยน ใช้ตัวหนังสือเป็นสีแดง ขณะที่ตัว ป. ใช้สีแดง ขาวและน้ำเงิน
โลโก้ใหม่
โลโก้เก่า",https://www.khaosod.co.th/politics/news_7560264,https://www.khaosod.co.th/wpapp/uploads/2023/03/%E0%B8%99%E0%B8%AD%E0%B8%97-300x169.jpg,"เลือกตั้ง66 , พรรคเปลี่ยน , นอท กองสลากพลัส , โลโก้ใหม่ , "
นราธิวาสเข้ม! จัดกำลังทหาร-ตร.กว่า 1 พันนาย รักษาความปลอดภัย บิ๊กตู่ ลงพื้นที่,การเมือง,"15 มี.ค. 2566
-
13:08 น.","นราธิวาสเข้ม จัดกำลังทหาร-ตำรวจกว่า 1,000 นาย รักษาความปลอดภัย คณะ‘บิ๊กตู่’ ลงพื้นที่ ด้าน นายก อบจ. นำผู้นำศาสนาร่วมละหมาดฮายัติ ก่อนทำพิธีเปิดแพขนานยนต์
วันที่ 15 มี.ค.2566) ผู้สื่อข่าวรายงานว่า เจ้าหน้าที่ทหาร ตำรวจ และฝ่ายความมั่นคง จัดกำลังรวมกว่า 1,000 นาย เตรียมความพร้อมรักษาความสงบเรียบร้อย พล.อ.ประยุทธ์ จันทร์โอชา นายกรัฐมนตรี และคณะ ที่จะเดินทางมาตรวจราชการที่จ.นราธิวาส ใน 2 อำเภอประกอบด้วย อ.เมือง และอ.ตากใบ ในช่วงบ่ายวันนี้
โดยนายกฯ จะเดินทางไปยัง พระพุทธทักษิณมิ่งมงคล (วัดเขากง) เพื่อสักการะพระพุทธทักษิณมิ่งมงคล และเข้านมัสการพระเทพศิลวิสุทธิ์ที่ปรึกษาเจ้าคณะภาค 18 อ.เมือง จ.นราธิวาส ในเวลา 13.15 น. พร้อมเป็นประธานในพิธีเปิดแพขนานยนต์ องค์การบริหารส่วนจังหวัด(อบจ.) นราธิวาส ที่ด่านศุลกากรตากใบ ต.เจ๊ะเห อ.ตากใบ จ.นราธิวาส ในเวลา 13.30 น. ก่อนเดินทางต่อไปยังมหาวิทยาลัยนราธิวาสราษชนครินทร์ และเดินทางไปยังท่าอากาศยานนราธิวาส ในเวลา 17.00 น. เพื่อเดินทางกลับไปยังกรุงเทพมหานคร
ทั้งนี้ เจ้าหน้าที่ได้จัดตั้งจุดตรวจ/ด่านตรวจในพื้นที่ต่างๆ พร้อมทำความเข้าใจกับประชาชนอย่างเข้มงวดทั้งทางบกและทางน้ำ โดยวางกำลังทุกเส้นทางและจุดเข้าออกทุกจุดเพื่อความปลอดภัย ตรวจความพร้อมด้านสถานที่ การเตรียมงาน การวางกำลัง การคัดกรองบุคคลก่อนเข้างาน ตลอดจนแผนรักษาความปลอดภัยตลอดเส้นทาง
นายกูเซ็ง ยาวอหะซัน นายก อบจ.นราธิวาส ได้นำผู้นำผู้ศาสนาร่วมละหมาดฮัติ เพื่อความสิริมงคลกับแพขนานยนต์ลำใหม่ พร้อมนำแพล่องแม่น้ำสุไหงโกลก",https://www.khaosod.co.th/politics/news_7560198,https://www.khaosod.co.th/wpapp/uploads/2023/03/%E0%B8%94%E0%B8%B9%E0%B9%81%E0%B8%A5%E0%B9%80%E0%B8%82%E0%B9%89%E0%B8%A1-300x169.jpg,-
จุรินทร์ ลั่น ปชป.ไม่หวั่นไหว หลัง ‘จุติ’ ทิ้งพรรค ยันไม่กระทบฐานเสียงพิษณุโลก,การเมือง,"15 มี.ค. 2566
-
12:52 น.","“บิ๊กตู่” ส่งการ์ดเบิร์ธเดย์ “จุรินทร์” ครบ 67 ปี ลูกพรรค-ขรก. แห่อวยพร ลั่นปชป. ไม่หวั่นไหว หลัง “จุติ” ไขก๊อก ชี้ไม่ใช่เรื่องใหม่ ยันผู้สมัครพิษณุโลกยังเหมือนเดิม
เมื่อเวลา 10.00 น. วันที่ 15 มี.ค. 2566 ที่พรรคประชาธิปัตย์ (ปชป.) ผู้สื่อข่าวรายงานว่า บรรยากาศที่พรรคประชาธิปัตย์เป็นไปอย่างคึกคัก เนื่องเป็นวันคล้ายวันเกิดครอบรอบ 67 ปี ของ นายจุรินทร์ ลักษณวิศิษฏ์ รองนายกรัฐมนตรี และรมว.พาณิชย์ ในฐานะหัวหน้าพรรค ซึ่งมีบรรดาผู้บริหารพรรค นำโดยนายองอาจ คล้ามไพบูลย์ รองหัวหน้าพรรค ดูแลกทม. นายไชยยศ จิรเมธากร รองหัวหน้าพรรค ดูแลภาคอีสาน
นายนราพัฒน์ แก้วทอง รองหัวหน้าพรรค ดูแลภาคเหนือ และสมาชิกพรรค ว่าที่ผู้สมัคร ส.ส. จากหลายพื้นที่ และข้าราชการหลายหน่วยงานในสังกัดรองนายกฯ ทั้งกระทรวงพาณิชย์ กระทรวงเกษตรและสหกรณ์ กระทรวงการพัฒนาสังคมและความมั่นคงของมนุษย์ (พม.) พร้อมด้วยเจ้าหน้าที่พรรค เข้าร่วมมอบแจกันดอกไม้ กระเช้าผลไม้ พวงมาลัย และอวยพร
นอกจากนั้น พล.อ.ประยุทธ์ จันทร์โอชา นายกรัฐมนตรี และรมว.กลาโหม มอบหมายให้นายประทีป กีรติเลขา รองเลขาธิการนายกฯ ฝ่ายการเมือง เป็นตัวแทนมอบการ์ดอวยพรนายจุรินทร์ในครั้งนี้ด้วย ทั้งนี้ นายจุรินทร์ ได้วางพวงมาลัย สักการะพระแม่ธรณีบีบมวยผม ซึ่งเป็นสิ่งศักดิ์สิทธิ์ประจำพรรคประชาธิปัตย์
นายจุรินทร์ ให้สัมภาษณ์ว่า ขอบคุณทุกคน โดยเฉพาะนายกฯ ที่มอบของขวัญวันเกิด และความปรารถนาดีให้ ซึ่งตนได้ฝากคำขอบคุณไปถึงนายกฯ และขอให้สิ่งศักดิ์สิทธิ์นำพรอันประเสริฐตอบแทนนายกฯ ด้วยเช่นกัน ขอบคุณส่วนราชการทั้งหมด และสมาชิกพรรค รวมทั้งเจ้าหน้าที่พรรคทุกคน ที่มาอวยพรและส่งความปารถนาให้กับตน ตนยืนยันจะมุ่งมั่นทุ่มเททำงานหนัก เพื่อนำพรรคประชาธิปัตย์ไปสู่ความเจริญรุ่งเรืองต่อไป นายจุรินทร์ กล่าว
นายจุรินทร์ กล่าวกรณีนายกรัฐมนตรีส่งสัญญาณยุบสภา มีการกำหนดวันยุบสภาแล้วหรือไม่ ว่า นายกฯ ยังไม่ได้ส่งสัญญาณใดๆ แต่คงไม่เกินเดือนนี้ เพราะเกินไม่ได้อยู่แล้ว ส่วนกำหนดวันเลือกตั้งก็คาดว่าเดือนพ.ค. ส่วนจะเป็นวันใดนั้นต้องขึ้นอยู่กับวันยุบสภาด้วย และนายกฯ ไม่ได้บอกว่าการประชุมคณะรัฐมนตรี (ครม.) เมื่อวันที่ 14 มี.ค.ที่ผ่านมา จะเป็นนัดสุดท้าย แต่การประชุมนัดสุดท้ายจะมีเมื่อไหร่ก็เมื่อนั้น
เมื่อถามว่าหากยังมีการประชุมครม.อีก มีโอกาสที่จะนำโครงการรถไฟฟ้าสายสีส้ม มาเสนอเข้าที่ประชุมครม.อีกหรือไม่ นายจุรินทร์ กล่าวว่า คงไม่มีการนำกลับมาพิจารณาแล้ว เพราะได้ถอนออกไปตั้งแต่เมื่อวันที่ 14 มี.ค.แล้ว ขณะเดียวกันในวันประชุมเมื่อวันที่ 14 มี.ค. ก็เห็นแล้วว่า รัฐมนตรีแต่ละคนมีความคิดเห็นต่อเรื่องนี้อย่างไร
เมื่อถามกรณีนายจุติ ไกรฤกษ์ รมว.การพัฒนาสังคมและความมั่นคงของมนุษย์ (พม.) และแกนนำภาคเหนือประชาธิปัตย์ ลาออกจากพรรคประชาธิปัตย์ ไปสังกัดพรรครวมไทยสร้างชาติ (รทสช.) นายจุรินทร์ กล่าวว่า ขอให้เจ้าตัวเป็นคนพูดเรื่องนี้เอง ตนขอไม่พูดถึง เพราะนายจุติไม่ได้มาลาตน ขณะเดียวกัน พรรคประชาธิปัตย์ก็ไม่ได้ถือว่าเรื่องนี้เป็นเรื่องใหม่ จากนี้ไปพรรคจะร่วมมือกันอย่างเป็นเอกภาพ และนำพรรคเดินหน้าฟันฝ่าอุปสรรค เพื่อไปสู่ความสำเร็จ
“มั่นใจว่าในการเลือกตั้งครั้งหน้า เราจะสามารถนำพาประเทศไปสู่ความสำเร็จตามเป้าหมายได้ ไม่มีอะไรมาทำลายเป้าหมายที่เราจับมือร่วมกัน สำหรับคนที่ยังยืนหยัดและเหนียวแน่นอยู่กับพรรค ผมจะตอบแทนทุกคนด้วยการมุ่งมั่นทำงานหนัก และไม่หวั่นไหวหรือท้อถอยหมดกำลังใจ เพราะคนที่ยังเหลืออยู่เป็นคนส่วนใหญ่ ซึ่งผมเป็น ส.ส. มา 11 สมัย เป็นรัฐมนตรีมาหลายกระทรวง ทำให้สั่งสมประสบการณ์ ซึ่งสิ่งเหล่านี้จะเป็นพลังสำคัญ ทำให้ผมจับมือกับสมาชิกพรรคที่ยังเหลือ นำพรรคไปสู่ความสำเร็จในอนาคตได้” นายจุรินทร์ กล่าว
เมื่อถามว่า การลาออกของนายจุติ จะส่งผลกระทบต่อฐานเสียงในภาคเหนือ โดยเฉพาะใน จ.พิษณุโลก หรือไม่ นายจุรินทร์ กล่าวว่า ไม่กระทบเป้าหมายอะไรทั้งนั้น และเรื่องอย่างนี้ไม่ใช่เรื่องใหม่ พรรคได้เตรียมการทุกอย่างไว้ทั้งหมดแล้ว และกำลังเดินหน้าต่อไป ขณะที่ผู้สมัครของพรรค ในจ.พิษณุโลก ก็ยังคงเดิมอยู่ทุกคน ไม่มีความหวั่นไหว ยังอยู่กับพรรค ไม่มีปัญหาอะไรเลย",https://www.khaosod.co.th/politics/news_7560030,https://www.khaosod.co.th/wpapp/uploads/2023/03/%E0%B8%88%E0%B8%B8%E0%B8%A3%E0%B8%B4%E0%B8%99%E0%B8%88%E0%B8%B8%E0%B8%95%E0%B8%B4-300x169.jpg,-
