Title,Topic,Date,Content,Link,Image,Tag
'ออสเตรเลีย'ตกลงซื้อเรือดำน้ำนิวเคลียร์ มหาอำนาจ'ออคัส'เดินหน้าโปรเจ็กต์กองเรือ,รอบโลก,"14 มี.ค. 2566
-
16:30 น.","‘ออคัส’ เดินหน้า-วันที่ 14 มี.ค.บีบีซีรายงานว่า กลุ่มออคัส ได้แก่ สหรัฐอเมริกา สหราชอาณาจักรและออสเตรเลียแถลงเห็นพ้องเดินหน้าโครงการเรือดำน้ำพลังงานนิวเคลียร์ พร้อมเผยรายละเอียดแผนที่จะสร้างกองเรือดำน้ำพลังงานนิวเคลียร์ขึ้นใหม่ มุ่งที่การตอบโต้อิทธิพลของจีนในภูมิภาคอินโด-แปซิฟิก เพื่อรับประกันว่าภูมิภาคนี้จะยังคงเสรีและเปิดกว้าง
นายโจ ไบเดน ผู้นำสหรัฐ นายแอนโทนี อัลบาเนซี นายกรัฐมนตรีออสเตรเลีย นายริชี สุนัค นายกรัฐมนตรีสหราชอาณาจักร ร่วมประชุมไตรภาคีที่ฐานทัพเรือพอยต์ โลมา ในเมืองซานติเอโก สหรัฐอเมริกา เมื่อ 13 มี.ค. ตามเวลาท้องถิ่น (รอยเตอร์)
ภายใต้ข้อตกลงของออคัส ออสเตรเลียจะซื้อเรือดำน้ำปรมาณูลำแรกของประเทศอย่างน้อยจำนวน 3 ลำจากสหรัฐอเมริกา โดยชาติพันธมิตรจะทำงานร่วมกันเพื่อสร้างกองเรือใหม่ที่ใช้เทคโนโลยีล้ำสมัยรวมถึงเครื่องปฏิกรณ์นิวเคลียร์ที่ผลิตโดยบริษัทโรลส์รอยซ์จากสหราชอาณาจักร
คณะผู้แทนจีนประจำสหประชาชาติหรือยูเอ็นระบุว่า ข้อตกลงดังกล่าวทำร้ายสันติภาพและเสถียรภาพและกล่าวหาพันธมิตร 3 ชาติตะวันตกทำให้ความพยายามที่จะรณรงค์ไม่ให้เผยแพร่อาวุธนิวเคลียร์ประสบความล้มเหลว แต่ประธานาธิบดีโจ ไบเดน ผู้นำสหรัฐอเมริการะบุว่า ข้อตกลงนี้มุ่งหวังที่จะส่งเสริมสันติภาพในภูมิภาคและเน้นย้ำว่า เรือดำน้ำดังกล่าวจะเป็นเรือดำน้ำพลังงานนิวเคลียร์ไม่ใช่ติดอาวุธนิวเคลียร์
นายหวัง เหวินปิน โฆษกกระทรวงการต่างประเทศจีนเตือนว่า ออสเตรเลีย สหราชอาณาจักร และสหรัฐอเมริกากำลังเหยียบย่างบนเส้นทางที่ผิดพลาดและอันตราย
นายโจ ไบเดน ผู้นำสหรัฐ นายแอนโทนี อัลบาเนซี นายกรัฐมนตรีออสเตรเลีย นายริชี สุนัค นายกรัฐมนตรีสหราชอาณาจักร แถลงหลังร่วมประชุมไตรภาคีที่ฐานทัพเรือพอยต์ โลมา ในเมืองซานติเอโก สหรัฐอเมริกา เมื่อ 13 มี.ค. ตามเวลาท้องถิ่น (รอยเตอร์)
นายไบเดนแถลงร่วมกับนายริชี สุนัค นายกรัฐมนตรีอังกฤษและนายแอนโทนี อัลบาเนซี นายกรัฐมนตรีออสเตรเลียที่ฐานทัพเรือพอยต์ โลมา เมืองซานติเอโก รัฐแคลิฟอร์เนีย ซึ่งนายไบเดนระบุว่า ข้อตกลงจะไม่ทำอันตรายต่อพันธกรณีของออสเตรเลียในการเป็นประเทศปลอดนิวเคลียร์
สำหรับออสเตรเลีย ถือเป็นการยกระดับศักยภาพทางทหาร และกลายเป็นประเทศลำดับที่ 2 รองจากสหราชอาณาจักรที่ได้รับเทคโนโลยีขับเคลื่อนนิวเคลียร์ระดับสูงสุดจากสหรัฐ ซึ่งภายใต้ข้อตกลง เรือดำน้ำจะสามารถปฏิบัติการได้มากขึ้นและเร็วขึ้นกว่ากองเรือดำน้ำพลังงานดีเซลที่มีอยู่ในปัจจุบัน
และออสเตรเลียจะสามารถทำภารกิจโจมตีศัตรูจากระยะไกลได้เป็นครั้งแรก รวมถึงทหารเรือออสเตรเลียจะถูกส่งไปที่ฐานทัพสหรัฐและสหราชอาณาจักรนับตั้งแต่ปีนี้เพื่อเรียนรู้วิธีใช้เรือดำน้ำพลังงานนิวเคลียร์
นายโจ ไบเดน ผู้นำสหรัฐ นายแอนโทนี อัลบาเนซี นายกรัฐมนตรีออสเตรเลีย นายริชี สุนัค นายกรัฐมนตรีสหราชอาณาจักร กำลังเดินเพื่อร่วมกล่าวถ้อยแถลง หลังร่วมประชุมไตรภาคีที่ฐานทัพเรือพอยต์ โลมา ในเมืองซานติเอโก สหรัฐอเมริกา เมื่อ 13 มี.ค. ตามเวลาท้องถิ่น (รอยเตอร์)
นับตั้งแต่ปีค.ศ.2027 หรือปีพ.ศ.2570 ทั้งสหรัฐและสหราชอาณาจักรจะตั้งฐานเรือดำน้ำขนาดเล็กในเมืองเพิร์ธ รัฐเวสต์เทิร์นออสเตรเลีย ก่อนที่ออสเตรเลียจะซื้อเรือดำน้ำ 3 ลำจากสหรัฐในช่วงต้นทศวรรษ 2030 พร้อมเสนอทางเลือกจะซื้อเพิ่มได้อีก 2 ลำ แผนหลังจากนั้นคือ ออกแบบและสร้างเรือดำน้ำพลังงานนิวเคลียร์สำหรับกองทัพเรือสหราชอาณาจักรและออสเตรเลีย หรือที่เรียกว่า เอสเอสเอ็น-ออคัสโมเดล
นายอัลบาเนซี ผู้นำออสเตรเลีย ระบุว่า แผนนี้ซึ่งทำให้ออสเตรเลียมีค่าใช้จ่ายราว 201,000 ล้านดอลล่าร์สหรัฐหรือราว 6 ล้านล้านบาทตลอดช่วงเวลากว่า 30 ปี นับเป็นการลงทุนในศักยภาพด้านกลาโหมของประเทศในคราวเดียวที่ใหญ่ที่สุดในประวัติศาสตร์ออสเตรเลีย และการสร้างเรือที่อู่ต่อเรือจะสร้างงานให้ชาวออสเตรเลียหลายพันตำแหน่งอีกด้วย
ขณะที่นายสุนัค นายกรัฐมนตรีสหราชอาณาจักรระบุว่า การรุกรานยูเครนอย่างผิดกฎหมายของรัสเซีย ความอหังการที่เพิ่มมากขึ้นของจีน พฤติกรรมที่ไร้เสถียรภาพของอิหร่านและเกาหลีเหนือ ทั้งหมดขมขู่ที่จะสร้างโลกที่ถูกนิยามร่วมกันโดยอันตราย ไร้ระเบียบและแบ่งแยก
………….
อ่านข่าวที่เกี่ยวข้อง:
•มหาอำนาจ’ออคัส’แข่งขีปนาวุธเหนือเสียง-หวั่นรัสเซีย จีนแซงไกล
•‘ออคัส’ผนึกดีล! ผุดเรือนิวเคลียร์",https://www.khaosod.co.th/around-the-world-news/news_7558483,https://www.khaosod.co.th/wpapp/uploads/2023/03/%E0%B8%9B%E0%B8%81%E0%B8%AD%E0%B8%AD%E0%B8%84%E0%B8%B1%E0%B8%AA%E0%B9%80%E0%B8%A7%E0%B8%9A-300x169.jpg,-
“มาซาโตชิ อิโตะ” มหาเศรษฐีผู้เปลี่ยนเซเว่น อีเลฟเว่น เป็นธุรกิจระดับโลก เสียชีวิตแล้วด้วยวัย 98 ปี,รอบโลก,"14 มี.ค. 2566
-
15:30 น.","“มาซาโตชิ อิโตะ” มหาเศรษฐีชาวญี่ปุ่นผู้เปลี่ยนเซเว่น-อีเลฟเว่น (7-eleven) กลายเป็นบริษัทยักษ์ใหญ่ระดับโลก เสียชีวิตแล้วด้วยวัย 98 ปี
บีบีซี รายงานว่า นายมาซาโตชิ อิโตะ มหาเศรษฐีชาวญี่ปุ่นผู้เปลี่ยนร้านสะดวกซื้อ 7-eleven ให้กลายเป็นอาณาจักรธุรกิจระดับโลกได้เสียชีวิตแล้วเมื่อวันที่ 10 มี.ค. ที่ผ่านมาในวัย 98 ปีจากความชราภาพ
ในปี 2499 นายอิโตะรับช่วงต่อธุรกิจร้านเสื้อผ้าขนาดเล็กในโตเกียวต่อจากลุงและพี่ชายต่างมารดา ก่อนจะเปลี่ยนชื่อเป็น “อิโต-โยกาโดะ” และเปลี่ยนธุรกิจให้เป็นเชนร้านสะดวกซื้อครบวงจรที่ขายทุกอย่างตั้งแต่ของชำไปจนถึงเสื้อผ้า และเข้าสู่ตลาดหลักทรัพย์ในปี 2515
ในช่วงเวลาเดียวกัน นายโตชิฟุมิ ซูซุกิ (Toshifumi Suzuki) ผู้บริหารคนหนึ่งของ อิโต-โยกาโดะ ได้พบร้านเซเว่น อีเลฟเว่น ขณะเดินทางเยือนสหรัฐ บริษัทเล็งเห็นโอกาสและทำข้อตกลงกับบริษัทเซาท์แลนด์ คอร์ปอเรชั่น (Southland Corporation) ในสหรัฐซึ่งเป็นเจ้าของเซเว่น อีเลฟเว่น และเปิดสาขาแรกในญี่ปุ่นในปี 2517
นายอิโตะเสียชีวิตด้วยโรคชรา
ต่อมาในเดือนมีนาคม 2533 บริษัทอิโต-โยกาโดะได้เข้าซื้อหุ้นบริษัทเซาท์แลนด์ คอร์ปอเรชั่นร้อยละ 70 และเข้ามามีสิทธิในการบริหารบริษัทเซาท์แลนด์ คอร์ปอเรชั่นทั้งหมด หลังบริษัทประสบปัญหาหนี้ท่วมจนต้องยื่นล้มละลาย ก่อนจะขยายสาขาเซเว่น อีเลฟเว่น ไปในหลายประเทศทั่วโลก
อย่างไรก็ตาม ในปี 2535 นายอิโตะลาออกจากตำแหน่งในอิโต-โยกาโดะ เพื่อรักษาความสงบเรียบร้อยในการประชุมผู้ถือหุ้น หลังผู้บริหาร 3 คนถูกกล่าวหาว่า จ่ายเงินให้กับแก๊งยากูซ่าอย่างผิดกฎหมาย จากนั้นในปี 2548 บริษัทอิโตะ-โยคาโดะเปลี่ยนชื่อเป็น เซเว่น แอนด์ ไอ โฮลดิงส์ ซึ่งคำว่า ไอ มีความหมายมาจาก อิโตะ-โยคาโดะ ชื่อบริษัทเดิม และนายอิโตะยังได้ดำรงตำแหน่งประธานกิตติมศักดิ์ด้วย
ทั้งนี้ ปัจจุบัน เซเว่น อีเลฟเว่น เป็นร้านสะดวกซื้อครบวงจรที่มีสาขามากกว่า 83,000 แห่งทั่วโลก โดยหนึ่งในสี่ของจำนวนสาขานี้อยู่ในประเทศญี่ปุ่น
ภาพประกอบ",https://www.khaosod.co.th/around-the-world-news/news_7558194,https://www.khaosod.co.th/wpapp/uploads/2023/03/333-4-300x169.jpg,-
กัมพูชาจัดแสดง “ผู้พิทักษ์ประตูยักษ์” หลายร้อยปี-หลังต่อ 6 ชิ้นส่วนแตกหักสำเร็จ,รอบโลก,"14 มี.ค. 2566
-
14:21 น.","กัมพูชาจัดแสดง – ซินหัว รายงานว่า องค์การอัปสราแห่งชาติกัมพูชาเปิดเผยว่านำรูปปั้น ผู้พิทักษ์ประตู อายุเก่าแก่หลายร้อยปีที่ซ่อมแซมเสร็จแล้วมาจัดแสดงต่อสาธารณชน ที่พิพิธภัณฑ์พระนโรดมสีหนุอังกอร์ จังหวัดเสียมราฐ ทางตะวันตกเฉียงเหนือของประเทศ
องค์การอัปสราซึ่งเป็นหน่วยงานรัฐบาลที่รับผิดชอบการจัดการ คุ้มครอง และอนุรักษ์อุทยานโบราณคดีอังกอร์ ระบุว่ารูปปั้นผู้พิทักษ์ประตูหินทรายนี้มีความสูง 1.82 เมตร กว้าง 0.78 เมตร และหนา 0.5 เมตร
กัมพูชาจัดแสดง – A centuries-old door guardian statue is on a public display at the Preah Norodom Sihanouk-Angkor Museum in northwest Cambodia’s Siem Reap province after being repaired, the Apsara National Authority (ANA) said in a news release on Monday. The sandstone door guardian statue is 1.82 meters high, 0.78 meters wide, and 0.5 meters thick, said the ANA, which is the government agency responsible for managing, safeguarding and preserving the famed Angkor Archeological Park. (ANA/Handout via Xinhua)
ด้าน นายกุน พัลลี หัวหน้าทีมจัดแสดงและมัคคุเทศก์ประจำพิพิธภัณฑ์ กล่าวว่ารูปปั้นผู้พิทักษ์ประตูขนาดใหญ่ตัวนี้เคยแตกหักออกเป็น 6 ส่วน เช่น ศีรษะ ลำตัว แขน ขา และต่างหู พร้อมเสริมว่าส่วนใบหน้าของรูปปั้นยังถูกกัดกร่อนจนทำให้ริมฝีปาก จมูก และดวงตาเกือบจะสูญเสียรูปทรง
หลังจากทีมงานได้ศึกษาประวัติของรูปปั้น การตกแต่ง และขนาดของความเสียหายทั้งภายในและภายนอกแล้ว คณะผู้เชี่ยวชาญจึงใช้เทคนิคการซ่อมแซมตามแต่ละขั้นตอน และปะติดปะต่อชิ้นส่วนเหล่านั้นกลับคืนสู่รูปเดิม อีกทั้งทีมงานยังได้สร้างฐานหินทรายสำหรับวางรูปปั้นขึ้นใหม่เพื่อรับรองความมั่นคงและปลอดภัย
องค์การอัปสรายังชี้ว่ารูปปั้นผู้พิทักษ์ประตูขนาดใหญ่นี้ถูกพบระหว่างการขุดค้นในปี 2560 ที่วัดโตนเลสงูตซึ่งเป็นโรงพยาบาลของชาวอังกอร์โบราณ ทางตอนเหนือของนครธม บริเวณพื้นที่ของอุทยานโบราณคดีอังกอร์ โดยคณะนักวิจัยสันนิษฐานว่ารูปปั้นอาจถูกสร้างขึ้นช่วงปลายศตวรรษที่ 12 และต้นศตวรรษที่ 13
กัมพูชาจัดแสดง – This undated photo shows a centuries-old larger-than-life door guardian statue displayed at a museum in Siem Reap province, Cambodia. Kun Phally, head of the exhibition team and a guide at the Preah Norodom Sihanouk-Angkor Museum, said the larger-than-life statue was broken into six different pieces, such as head, body, arms, legs, and earrings. He added that its face was also eroded, almost losing the shape of lips, nose, and eyes. (ANA/Handout via Xinhua)
 ข่าวที่เกี่ยวข้อง:
กัมพูชาลุยบูรณะ “ราวสะพานพญานาค” นครวัด ทำจากหินทราย-ความยาว 50 เมตร
อังกฤษส่ง “เครื่องราชกกุธภัณฑ์” สมัยพระนคร 77 ชิ้นที่ถูกขโมย-คืนถิ่นกัมพูชา
กัมพูชายินดี! ผู้เชี่ยวชาญบูรณะเสร็จแล้ว “ประตูตาคาบ” ปราสาทนครธม",https://www.khaosod.co.th/around-the-world-news/news_7557864,https://www.khaosod.co.th/wpapp/uploads/2023/03/Centuries-olddoorguardianstatuedisplayed-02-300x169.jpg,-
ซากุระหางโจวบานสะพรั่ง จีนเดินหน้าแผน “เศรษฐกิจชมดอกไม้” ฟื้นฟูชนบท,รอบโลก,"14 มี.ค. 2566
-
13:01 น.","ซากุระหางโจวบานสะพรั่ง – ซินหัว เผยแพร่ภาพ สวน ดอกซากุระหางโจว ที่หมู่บ้านถังปู้ ตำบลผิงเหยา เขตอวี๋หาง เมืองหางโจว มณฑลเจ้อเจียง ทางตะวันออกของ ประเทศจีน หลังเข้าสู่ช่วงบานสะพรั่ง ดึงดูดให้นักท่องเที่ยวจำนวนมากแห่เดินทางมาเที่ยวชมและเพลิดเพลินกับทิวทัศน์ธรรมชาติที่สวยดุจภาพวาด
ด้านทางการท้องถิ่นประกาศเดินหน้าใช้ประโยชน์จากทรัพยากรทางนิเวศวิทยา ผลักดันแผน “เศรษฐกิจชมดอกไม้” เพื่อช่วยฟื้นฟูระบบเศรษฐกิจในชนบท
ซากุระหางโจวบานสะพรั่ง – This aerial photo taken on March 13, 2023 shows cherry blossoms in Tangbu Village of Yuhang District in Hangzhou, east China’s Zhejiang Province. The cherry blossoms in full bloom attracted many tourists. (Xinhua/Xu Yu)
This aerial photo taken on March 13, 2023 shows cherry blossoms in Tangbu Village of Yuhang District in Hangzhou, east China’s Zhejiang Province. The cherry blossoms in full bloom attracted many tourists. (Photo: Xinhua/Xu Yu)
ซากุระหางโจวบานสะพรั่ง – This aerial photo taken on March 13, 2023 shows cherry blossoms in Tangbu Village of Yuhang District in Hangzhou, east China’s Zhejiang Province. The cherry blossoms in full bloom attracted many tourists. (Photo: Xinhua/Xu Yu)
Tourists walk past cherry blossoms in Tangbu Village of Yuhang District in Hangzhou, east China’s Zhejiang Province, March 13, 2023. The cherry blossoms in full bloom attracted many tourists. (Photo: Xinhua/Xu Yu)
ซากุระหางโจวบานสะพรั่ง – This aerial photo taken on March 13, 2023 shows cherry blossoms in Tangbu Village of Yuhang District in Hangzhou, east China’s Zhejiang Province. The cherry blossoms in full bloom attracted many tourists. (Photo: Xinhua/Xu Yu)
 ข่าวที่เกี่ยวข้อง:
ภาวะโลกร้อนเร่งให้ฤดูกาลซากุระบาน มาถึงเร็วที่สุดในรอบ 1,200 ปี
บานแล้ว! ชาวญี่ปุ่นตื่นตาตื่นใจ ‘ต้นซากุระ’ออกดอกในฤดูใบไม้ร่วง",https://www.khaosod.co.th/around-the-world-news/news_7557654,https://www.khaosod.co.th/wpapp/uploads/2023/03/CherryblossomsinHangzhou-02-300x169.jpg,-
