Title,Topic,Date,Content,Link,Image,Tag
รวบแล้ว หนุ่มตระเวนฉกมือถือ คนขึ้นรถเมล์ อ้างขายปลาหมึก รายได้ไม่พอใช้,อาชญากรรม,"15 มี.ค. 2566
-
12:34 น.","สืบทองหล่อรวบหนุ่มฉกมือถือคนขึ้นรถ ปากซอยไป่สิงโตย่านพระราม 4 อ้างขายปลาหมึกปิ้งรายได้ไม่พอจึงล้วงกระเป๋านำมือถือไปขาย
วันที่ 15 มี.ค. 66 พ.ต.อ.พันษา อมราพิทักษ์ ผกก.สน.ทองหล่อ พ.ต.ท.ปุณณวิช อรรคนันท์ รองผกก.สส.สน.ทองหล่อ พ.ต.ท.อัครพล ธนธรรม สว.สส.สน.ทองหล่อพ.ต.ต.มานะ มะเซิง สว.สส.สน.ทองหล่อ ร.ต.อ.สมยศ หมาดสง่า รอง สว.สส.สน.ทองหล่อ และเจ้าหน้าที่ฝ่ายสืบสวนสน.ทองหล่อ ร่วมกันจับกุมตัวนายลอง โซวัน อายุ 46 ปี สัญชาติกัมพูชา
พร้อมด้วยของกลาง กระเป๋าสะพายสีน้ำตาล 1 ใบ เสื้อแจ็กเก็ต สีกรม 1 ตัว ซุกซ่อนอยู่ในกระเป๋าสะพายที่ผู้ต้องหาสะพายอยู่ หลังควบคุมตัวมาห้องปฏิบัติการสืบสวน สน.ทองหล่อ แขวงคลองเตย เขตคลองเตย กรุงเทพมหานคร เมื่อวันที่ 13 มี.ค. เวลาประมาณ 22.00 น. ที่ผ่านมา
สืบเนื่องจากผู้เสียหาย มาแจ้งความต่อพนักงานสอบสวน สน.ทองหล่อ ว่า เมื่อวันที่ 24 ก.พ. 66 ขณะที่ผู้เสียหายกำลังขึ้นรถโดยสารประจำทาง ปากซอยไผ่สิงโต ถนนพระราม 4 มีคนร้ายลักเอาโทรศัพท์ ไอโฟน 12 โปรแม็ก สีเทา ในกระเป๋าไป
เจ้าหน้าที่ตำรวจฝ่ายสืบสวนสน.ทองหล่อ จึงได้ตรวจสอบกล้องวงจรปิดใกล้ที่เกิดเหตุ พบคนร้ายเป็นชาย 1 คน สวมเสื้อสีฟ้า สะพายกระเป๋าสีน้ำตาล มีเสื้อสีกรม คล้องอยู่ที่แขน ล้วงกระเป๋าลักเอาโทรศัพท์ขณะผู้เสียหายกำลังจะขึ้นรถ หลังก่อเหตุได้หลบหนีข้ามถนนไปฝั่งตรงข้ามที่เกิดเหตุ
ต่อมา วันที่ 2 มี.ค.66 เจ้าหน้าที่ตำรวจรับแจ้งจากผู้เสียหายว่า คนร้ายที่ก่อเหตุ มายืนรอเพื่อที่จะก่อเหตุ อยู่ที่ป้ายรถประจำทางที่เดิมอีก เจ้าหน้าที่ตำรวจจึงเดินทางไปยังบริเวณดังกล่าว แต่ไม่พบคนร้าย พบเพียงผู้เสียหายที่ยืนรอเจ้าหน้าที่ตำรวจอยู่ จากการสอบถาม ผู้เสียหายแจ้งว่า คนร้ายพยายามจะก่อเหตุล้วงกระเป๋าผู้ที่ยืนรอรถอยู่ แต่เจ้าของทรัพย์รู้ตัว จึงตีไปที่มือคนร้ายทำให้ขึ้นรถหลบหนีไป
กระทั่ง 14 มี.ค. ผู้เสียหายแจ้งเจ้าหน้าที่ตำรวจว่า เห็นคนร้ายที่ก่อเหตุลักเอาโทรศัพท์ไอโฟนของตนไป อยู่ที่ป้ายรถประจำทางที่เดิม เจ้าหน้าที่ตำรวจชุดจับกุม จึงเดินทางไปยังบริเวณดังกล่าว เมื่อไปถึงพบนายลอง โซวัน ยืนอยู่ในลักษณะมองซ้ายมองขวาคล้ายกับหาคนที่จะลงมือก่อเหตุ แต่ผู้ต้องหาหันมาเจอกับเจ้าหน้าที่ตำรวจ จึงเดินหลบหนี ขึ้นรถแท็กซี่ เจ้าหน้าที่ตำรวจจึงแสดงตัวขอตรวจค้น
จากการตรวจค้นไม่พบสิ่งผิดกฎหมาย พบสำเนาหนังสือเดินทาง จากนั้นจึงเชิญตัวมาที่ห้องปฎิบัติการฝ่ายสืบสวน เพื่อเปรียบเทียบตำหนิรูปพรรณ ที่ได้จากกล้องวงจรปิดในวันเกิดเหตุ พบว่าเป็นบุคคลเดียวกัน กระเป๋าที่สะพายอยู่เป็นใบเดียวกันที่สะพายในวันเกิดเหตุ และยังพบเสื้อสีตรงกันกับเสื้อที่พาดแขนอยู่ในวันเกิดเหตุ
ขณะเดียวกันผู้เสียหาย ได้เดินทางตามมายัง สน.ทองหล่อ แล้วได้ชี้ยืนยันว่า บุคคลดังกล่าวเป็นคนเดียวกับที่ก่อเหตุลักเอาโทรศัพท์ของตนไปจริง เนื่องจากก่อนเกิดเหตุ ได้มายืนอยู่ข้างผู้เสียหาย จึงมีพยานหลักฐานเชื่อได้ว่าเป็นคนร้ายที่ลักเอาทรัพย์ของผู้เสียหายไปจริง อันเป็นเหตุให้ออกหมายจับได้ แต่ไม่สามารถขอให้ศาลออกหมายจับได้ทัน ตามประมวลกฎหมายวิธีพิจารณาความอาญา มาตรา 78(3) จึงจับกุม แจ้งข้อกล่าวหา ให้ทราบว่า “วิ่งราวทรัพย์”
จากการสอบสวนรับสารภาพตลอดข้อกล่าวหา และให้การเพิ่มเติมว่า ผู้ต้องหามีอาชีพขายปลาหมึกย่าง แต่รายจ่ายไม่พอ จึงได้ตระเวนล้วงกระเป๋าของเหยื่อบริเวณป้ายรถโดยสารประจำทาง ซึ่งผู้ต้องหาก่อเหตุมาแล้วหลายท้องที่ เช่น ป้ายรถประจำทางบ่อนไก่ พระรามสี่ พระโขนง และ อ่อนนุช
หลังก่อเหตุ จะเก็บรวบรวมโทรศัทพ์ที่ได้ 2-3 เครื่องก็จะนำไปขายที่ร้านโทรศัพท์ที่ ต.ปอยเปต ประเทศกัมพูชา จนกระทั่งวันนี้ ขณะที่ตนมารอเพื่อล้วงกระเป๋าที่ป้ายรถโดยสารประจำทาง ถนนพระรามสี่
เบื้องต้นได้นำตัวผู้ต้องหาพร้อมของกลางส่งพนักงานสอบสวนสถานีตำรวจนครบาลทองหล่อ เพื่อดำเนินคดีตามกฎหมายต่อไป",https://www.khaosod.co.th/crime/news_7559746,https://www.khaosod.co.th/wpapp/uploads/2023/03/%E0%B8%9B%E0%B8%81%E0%B8%95%E0%B8%A3%E0%B8%B0%E0%B9%80%E0%B8%A7%E0%B8%99%E0%B8%89%E0%B8%81%E0%B8%A1%E0%B8%B7%E0%B8%AD%E0%B8%96%E0%B8%B7%E0%B8%AD-300x169.jpg,-
สืบคลองตัน รวบคนร้ายลักรถจยย.ขายต่อ หนุ่มวินรับซื้อไม่รอดโดนด้วย รับของโจร,อาชญากรรม,"15 มี.ค. 2566
-
11:39 น.","สืบคลองตัน รวบคนร้ายลักรถจยย.ขายต่อ หนุ่มวินรับซื้อไม่รอดโดนด้วย รับของโจร ตรวจพบประวัติมีคดีติดตัวเพียบ
วันที่ 15 มี.ค.2566 พล.ต.ต.ธวัชเกียรติ จินดาควรสนอง ผบก.น.5 ได้รับรายงานจาก พ.ต.อ.วชิรากรณ์ วงศ์บุญ ผกก.สน.คลองตัน ว่าเมื่อวานนี้ ตำรวจฝ่ายสืบสวน สน.คลองตัน สามารถจับกุมนายทศพล หรือแตงกวา อายุ 32 ปี และนายพงศ์กฤต หรือเกมส์ อายุ 30 ปี พร้อมของกลางรถจยย.ฮอนด้า เวฟ 110 ไอ สีน้ำเงิน-ขาว เลขทะเบียน ขรธ 902 สุรินทร์ และหมวกกันน็อกแบบครึ่งใบ โดยจับกุมได้ที่ห้องพักย่านหัวหมาก ต่อเนื่องปากซอยพระราม 6 ซอย 28 เขตพญาไท กทม.
สืบเนื่องจากเมื่อเวลา 03.00 น. วันที่ 8 มี.ค. 2566 มีผู้เสียหายเข้าแจ้งความว่า ถูกคนร้ายลักรถจยย. ซึ่งจอดอยู่บริเวณลานจอดรถอาคารไพบูลย์แมนชั่น ซอยพัฒนาการ2 จึงประสานฝ่ายสืบสวนลงพื้นที่ตรวจสอบภาพจากกล้องวงจรปิดจนพบเบาะแสของคนร้าย จึงเฝ้าติดตามพฤติกรรมจนแน่ว่าเป็นผู้ลงมือก่อเหตุจริง จึงนำกำลังเข้าไปควบคุมตัว
จากการสอบสวน นายทศพล สารภาพว่า เป็นผู้ลงมือก่อเหตุจริง ก่อนนำรถของกลางไปขายต่อให้นายพงศ์กฤต ในราคา 3,200 บาท เพื่อนำเงินไปเที่ยวเตร่ และใช้จ่ายในชีวิตประจำวัน ก่อนถูกทางเจ้าหน้าที่ติดตามจับกุมได้ดังกล่าว จากนั้นเจ้าหน้าที่จึงขยายผลจับกุมนายพงศ์กฤต ซึ่งยืนอยู่บริเวณวินรถจยย.รับจ้าง บริเวณถนนพระราม 6 ซอย 28
นายพงศ์กฤต ให้การว่า รับซื้อรถของกลางมาจริง โดยโอนเงินผ่านแอพธนาคาร ก่อนนำไปซุกซ่อนบริเวณหน้าสถานที่ก่อสร้างแห่งหนึ่ง ริมถนนพหลโยธินระหว่างซอย 1-3 แขวงสามเสนใน เขตพญาไท กทม. เพื่อเตรียมนำมาใช้งานตามปกติจนกระทั่งมาถูกจับกุมได้ดังกล่าว เบื้องต้นนายทศพล ถูกแจ้งข้อหา“ลักทรัพย์ในเวลากลางคืน” ส่วนนายพงศ์กฤต ถูกดำเนินคดีในข้อหา “รับของโจร” ก่อนนำตัวพร้อมของกลางส่งพนักงานสอบสวนดำเนินคดีต่อไป
รายงานข่าวแจ้งว่า จากการตรวจสอบประวัติของนายทศพล เคยมีประวัติคดีฉ้อโกงในปี 59, ตัวการลักทรัพย์ในเวลากลางคืน ปี 61 และเสพยาเสพติดให้โทษหรือเสพวัตถุที่ออกฤทธิ์ต่อจิตและประสาท ตามที่อธิการบดีกำหนดในขณะขับขี่(วรรคหนึ่ง)เป็นเหตุให้ผู้อื่นรับอันตรายสาหัส, ตัวการมีไว้ในครอบครอง ซึ่งยาเสพติดให้โทษประเภท 1 ปี พ.ศ. 61 ส่วนนายพงศ์กฤต มีประวัติเกี่ยวกับยาเสพติดอีกหลายคดี",https://www.khaosod.co.th/crime/news_7559798,https://www.khaosod.co.th/wpapp/uploads/2023/03/%E0%B8%84%E0%B8%A5%E0%B8%AD%E0%B8%87%E0%B8%95%E0%B8%B1%E0%B8%992-44-300x169.jpg,"รับของโจร , "
หนีไปแล้ว! 3 ผู้ต้องสงสัยหลังได้ประกันตัว คดีอุ้มฆ่าฝังดินสาวใหญ่ รอผลชันสูตรศพ,อาชญากรรม,"14 มี.ค. 2566
-
17:37 น.","หนีไปแล้ว! 3 ผู้ต้องสงสัยหลังได้ประกันตัว คดีอุ้มฆ่าฝังดินสาวใหญ่ รอผลชันสูตรศพ
จากกรณีพบศพ น.ส.สุดารัตน์ อรรถวิจิตต์ อายุ 42 ปี ถูกฆ่าฝังดินกลางหุบเหว หลังสำนักสงฆ์เขาล้อม หมู่ 7 ต.พรหมโลก อ.พรหมคีรี จ.นครศรีธรรมราช หลังหายตัวจากบ้านเมื่อวันที่ 14 ก.พ.ที่ผ่านมา โดยพบแผลถูกยิงที่คอกระสุนฝังใน ตามที่เสนอข่าวไปแล้วนั้น
ความคืบหน้าล่าสุดวันที่ 14 มี.ค.66 ที่ศูนย์นิติเวช รพ.มหาราชนครศรีธรรมราช ซึ่งมีศพของ น.ส.สุดารัตน์ อยู่ในระหว่างการผ่าชันสูตรของทีมแพทย์นิติเวชอย่างละเอียด เพื่อหาหากระสุนที่ติดอยู่ที่ลำคอซึ่งเป็นหลักฐานสำคัญ และหาสาเหตุการตายที่ชัดเจน รวมทั้งช่วงเวลาที่ น.ส.สุดารัตน์ เสียชีวิต เพื่อเป็นหลักฐานเชื่อมโยงในคดีที่คนร้ายอุ้มฆ่า อาจต้องใช้เวลาในการผ่าชันสูตรอย่างน้อย 2 วัน
ส่วนความคืบหน้าในการคลี่คลายคดีนั้น ตำรวจระบุว่า ไม่มีความกังวล เนื่องจากคดีนี้ซึ่งได้สืบสวนมาอย่างต่อเนื่อง นับแต่ น.ส.สุดารัตน์ หายตัวไปตั้งแต่วันที่ 14 ก.พ โดยมีพยานหลักฐานสามารถออกหมายจับบุคคลที่เข้าไปยังบ้านของผู้ตายในท้องที่ ต.ช้างกลาง อ.ช้างกลาง ซึ่งมีบุคคลนำตัวผู้ตายออกจากบ้านในดังกล่าว แต่ปัญหาใหญ่ของเจ้าหน้าที่คือไม่มีหลักฐานและไม่พบตัวของผู้ตายประมาณกว่า 1 เดือนก่อนจะพบศพ
ก่อนหน้านี้เจ้าหน้าที่สามารถออกหมายจับบุคคลต้องสงสัยในข้อหาร่วมกันลักทรัพย์ในเคหะสถานในเวลากลางคืน หรือรับของโจร ร่วมกันบุกรุกเคหะสถานในเวลากลางคืน โดยผู้ที่ถูกออกหมายจับคือ นายสุขพินันท์ อายุ 46 ปี นายบุญยืน อายุ 46 ปี ทั้งคู่ได้ถูกจับกุมตัว และอีกคนคือ นายธนวิชญ์ อายุ 43 ปี ซึ่งเข้ามอบตัว โดยทั้ง 3 รายนั้นได้รับการประกันตัวแต่ปรากฏว่าได้หลบหนีไปแล้ว
นอกจากนั้นยังมีการออกหมายจับกุมผู้เกี่ยวข้องอีก 1 รายคือ นายพีรนัฐ ในข้อหาทำร้ายร่างกายบุพการี ซึ่ง นายพีรนัฐ นั้นเป็นคนที่ได้ข้อมูลสำคัญในการคลี่คลายคดีและค้าหาศพ น.ส.สุดารัตน์ จนเจอ ส่วนรถยนต์ของผู้ตายเป็นโตโยต้าฟอร์จูนเนอร์ทะเบียน ขค-1797 นครศรีธรรมราช ได้ถูกตรวจยึดและจับกุมผู้ขับขี่ไว้ได้ 1 ราย ซึ่งเป็นผู้หญิงที่นั่งมาด้วยกัน ในท้องที่ด่านน้ำพุร้อน จ.กาญจนบุรี
และตอนนี้เจ้าหน้าที่ได้เร่งออกติดตาม นายสุขพินันท์, นายบุญยืน และ นายธนวิชญ์ อย่างเร่งด่วนแล้ว เพื่อนำไปสู่การสอบสวนไขคดีอุ้มฆ่า น.ส.สุดารัตน์ ส่วนสาเหตุเจ้าหน้าที่ยังคงตั้งประเด็นเดิมคือขัดแย้งเรื่องยาเสพติด ที่สามีของ น.ส.สุดารัตน์ ผู้ค้ารายใหญ่ถูกจับกุมและจะไปค้างหนี้ในขบวนการค้ายา จึงมีการทวงหนี้ค่ายาเสพติดจาก น.ส.สุดารัตน์ จนเป็นมูลเหตุในการอุ้มและฆ่าฝังดินดังกล่าว
 ",https://www.khaosod.co.th/crime/news_7559130,https://www.khaosod.co.th/wpapp/uploads/2023/03/%E0%B8%AB%E0%B8%99%E0%B8%B5%E0%B9%81%E0%B8%A5%E0%B9%89%E0%B8%A7-300x169.jpg,-
