Title,Topic,Date,Content,Link,Image,Tag
นายกฯ หญิงนิวซีแลนด์ อำลาตำแหน่ง เดือนหน้า-ลั่นประเทศต้องการคนใหม่ๆ,รอบโลก,"19 ม.ค. 2566
-
10:23 น.","นายกฯ หญิงนิวซีแลนด์ อำลาตำแหน่ง เดือนหน้า-ลั่นประเทศต้องการคนใหม่ๆ มาเป็นผู้นำ
นายกฯ หญิงนิวซีแลนด์  บีบีซี รายงานวันที่ 19 ม.ค. ว่า นางจาซินดา อาร์เดิร์น นายกรัฐมนตรีหญิงแห่งนิวซีแลนด์ แถลงว่าจะลาออกจากตำแหน่งผู้นำประเทศ รวมถึงหัวหน้าพรรคแรงงานนิวซีแลนด์ภายในวันที่ 7 ก.พ.ที่จะถึงนี้ และจะจัดการเลือกตั้งทั่วไปในวันที่ 14 ต.ค.
Powered By
การประกาศลาออกของนางอาร์เดิร์นเกิดขึ้นท่ามกลางผลสำรวจคะแนนนิยมที่ลดลงอย่างต่อเนื่อง อย่างไรก็ตาม ผู้นำหญิงกล่าวย้ำถึงเหตุผลที่ลาออกว่าไม่ใช่เพราะไม่มั่นใจว่าพรรคแรงงานจะชนะการเลือกตั้งครั้งหน้า แต่ประเทศต้องการคนใหม่ๆ ขึ้นมาเป็นผู้นำ
ฉันหวังว่าจะเจอสิ่งที่ทำให้ฉันทำต่อไปได้ แต่น่าเสียดายที่ฉันไม่เจอสิ่งนั้น และหากฉันยังทำต่อไปก็อาจจะทำให้นิวซีแลนด์เสียผลประโยชน์ นางอาร์เดิร์นกล่าว
New Zealand Prime Minister Jacinda Ardern grimaces as she announces her resignation at a press conference in Napier, New Zealand Thursday, Jan. 19, 2023. Ardern says that she will not contest this years general elections. (Warren Buckland/New Zealand Herald via AP)
ทั้งนี้ นางอาร์เดิร์นในวัย 42 ปี กลายเป็นผู้นำหญิงที่มีอายุน้อยที่สุดของโลกหลังชนะการเลือกตั้งและดำรงตำแหน่งเป็นนายกรัฐมนตรีนิวซีแลนด์ในปี 2560 ขณะมีอายุ 37 ปี จากนั้นราวๆ 1 ปีต่อมานางอาร์เดิร์นคลอดลูกและขึ้นแท่นเป็นผู้นำคนที่สองของโลกที่ให้กำเนิดบุตรระหว่างทำหน้าที่บริหารประเทศ
นอกจากการเป็นผู้นำรุ่นใหม่แล้วนางอาร์เดิร์นยังได้รับการยอมรับและคำชื่นชมจากทั่วโลกถึงมาตรการรับมือกับการระบาดของโรคโควิด-19 ซึ่งนิวซีแลนด์เป็นหนึ่งในไม่กี่ประเทศที่สามารถควบคุมการระบาดรุนแรงได้
แต่ผู้นำหญิงมองว่าการบริหารประเทศในช่วงสงบสุขนั้นแตกต่างอย่างสิ้นเชิงในยามที่เผชิญวิกฤต สถานการณ์เหล่านี้เพิ่มความหนักอึ้งให้กับการทำงาน และแทบไม่เคยมีช่วงเวลาไหนเลยที่จะรู้สึกว่าเราเป็นเพียงฝ่ายปกครอง
Fighting back tears, Ardern told reporters in Napier that Feb. 7 will be her last day as prime minister. I am entering now my sixth year in office, and for each of those years, I have given my absolute all, she said. She also announced that New Zealands next general elections would be held on Oct. 14, and that she would remain a lawmaker until then. (Warren Buckland/New Zealand Herald via AP)
New Zealand Prime Minister Jacinda Ardern, right, hugs her fiancee Clark Gayford after announcing her resignation at a press conference in Napier, New Zealand, Thursday, Jan. 19, 2023. Fighting back tears, Ardern told reporters that Feb. 7 will be her last day in office. (Mark MItchell/New Zealand Herald via AP)
 ข่าวที่เกี่ยวข้อง:
จาซินดา อาร์เดิร์น นายกฯ หญิงนิวซีแลนด์ ขึ้นแท่นผู้บริหารดีที่สุดในโลก
โควิด : จาซินดา อาร์เดิร์น ตอกแรง ทรัมป์ พูดมั่วกีวีสาหัส-ระบาดระลอกใหญ่",https://www.khaosod.co.th/around-the-world-news/news_7466285,https://www.khaosod.co.th/wpapp/uploads/2023/01/Arderntoleaveoffice-02-300x169.jpg,"นายกฯ หญิงนิวซีแลนด์ , นายกรัฐมนตรีลาออก , จาซินดา อาร์เดิร์น , นิวซีแลนด์ "
สาวคัพ 34 KK เปิดใจใช้ชีวิตลำบาก เต้าอึ๋มชนของพัง-บินชั้นประหยัดไม่ได้,รอบโลก,"19 ม.ค. 2566
-
09:09 น.","สาวคัพ 34 KK เปิดใจใช้ชีวิตลำบาก เต้าอึ๋มชนของพัง-บินชั้นประหยัดไม่ได้
สาวคัพ 34 KK  เดอะซัน เปิดเผยเรื่องราวของ น.ส.อนาสตาซิย่า เบอร์ทิเออร์ นางแบบสาวทรงโตกับขนาดหน้าอกคัพ 34 เคเค แม้หญิงสาวจะภูมิใจในความบะละฮึ่มของทรวงอกซึ่งอนาสตาซิย่าย้ำว่าเป็นของแท้แม่ให้มาล้วนๆ แต่ก็มีหลายครั้งที่ต้องโอดครวญเพราะความอึ๋มเป็นเหตุทำให้การใช้ชีวิตประจำวันมีอุปสรรค
Powered By
สาวรัสเซียวัย 26 ปีที่ตอนนี้ย้ายมาอยู่นครดูไบ สหรัฐอาหรับเอมิเรตส์ (ยูเออี) และมีผู้ติดตามเพจอินสตาแกรมมากกว่า 1.5 ล้านบัญชี เปิดเผยกับเว็บไซต์แห่งหนึ่งว่าต้องใช้ชีวิตอย่างระมัดระวังเพราะหน้าอกขนาดใหญ่ของตนมักจะชนกับสิ่งของต่างๆ ในบ้านจนล้มระเนระนาด แถมยังเกิดเหตุหน้าอกชนคนอื่นหลายครั้งด้วย
Anastasiya Berthier, 26, who insists her breasts are natural, says she needs to take precautionary measures to ensure they dont get in the way. Although she loves her breasts, Anastasiya says she is constantly crushing things around the house and has even accidentally hit others with them. /Credit: Jam Press/@artdikaya_/
ฉันนั่งเครื่องบินชั้นธุรกิจเป็นประจำ ไม่ก็นั่งเฟิสต์คลาส โดยเฉพาะถ้าต้องเดินทางไกล อนาสตาซิย่ากล่าว และว่าที่นั่งตั้งแต่ชั้นธุรกิจขึ้นไปมีพื้นที่มากพอเมื่อเทียบกับชั้นประหยัดซึ่งตนไม่สามารถนั่งได้เพราะขนาดหน้าอกที่หญ่มากจนเคลื่อนไหวไม่สะดวกในพื้นที่จำกัด
อนาสตาซิย่ากล่าวอีกว่าไม่ใช่แค่ใช้ชีวิตลำบาก เพราะตอนทำงานก็ได้รับผลกระทบเช่นกัน เวลาฉันลองเสื้อผ้าที่ร้าน พอสวมไปแล้วก็มักจะติดหน้าอกจนดึงออกไม่ได้ และต้องเรียกให้คนอื่นมาช่วย บางครั้งทรวดทรงของฉันก็ทำให้เสื้อผ้าฉีกขาดตอนที่ฉันพยายามถอดออก มันน่าหงุดหงิดจริงๆ แต่เสื้อผ้าเหล่านี้ก็ดูฮอตสุดๆ เมื่อฉันสวมใส่
She told NudePR.com: I always fly business or first class, especially for a long flight. This is because you can unfold the chair and stretch your back, also I prefer more privacy. My breasts have caused clumsy accidents  sometimes its so awkward. /Credit: Jam Press/@artdikaya_/
หญิงสาวเล่าอีกว่าผู้คนมักจะมองตามจนเหลียวหลังเวลาตนออกไปเดินนอกบ้าน และเกือบเกิดเหตุรถชน ฉันลองไปขี่ม้าและตัดสินใจใส่เสื้อที่โชว์ส่วนอกเยอะๆ ทุกอย่างไม่มีปัญหาอะไรจนกระทั่งม้าเริ่มออกวิ่งและหน้าอกของฉันก็เด้งหลุดโผล่พ้นเสื้อ
ฉันไม่คิดว่าจะเกิดเหตุการณ์แบบนี้ ฉันไม่ทันตั้งตัวและไม่ได้ปิดหน้าอกทันทีทันใด นั่นทำให้คนขับรถที่ผ่านมาช็อกหนักจนเกือบจะขับรถเสียหลัก อนาสตาซิย่าทิ้งท้าย
The model who is originally from Moscow, Russia, now lives in Dubai and often shares snaps of her life with her 1.5 million fans on Instagram. The large chest is also a struggle for the model when trying to find clothes that fit. /Credit: Jam Press/@artdikaya_/
 ข่าวที่เกี่ยวข้อง:
สาวสะบึม ทุ่ม 14 ล้าน ผ่าหน้าอก 38 ครั้ง เกือบตาย 4 หน ฝันอยากใหญ่ที่สุดในโลก
สาวป่วยหายาก หน้าอก โตไม่เท่ากัน โดนเพื่อนบูลลี่หนัก ลั่นจะไม่ผ่าตัดแก้ไข",https://www.khaosod.co.th/around-the-world-news/news_7465869,https://www.khaosod.co.th/wpapp/uploads/2023/01/cantflyeconomybecausemychest-02-300x169.jpg,"สาวคัพ 34 KK , หน้าอกใหญ่ , นางแบบ , เซ็กซี่ "
จับมะกันวัย 14 ทะเลาะโหด-ชักปืนยิงเพื่อน แต่พลาดโดนเด็กชายที่ไม่เกี่ยวข้อง ดับคาที่,รอบโลก,"18 ม.ค. 2566
-
17:50 น.","จับมะกันวัย 14 ทะเลาะโหด-ชักปืนยิงเพื่อน แต่พลาดโดนเด็กชายที่ไม่เกี่ยวข้อง ดับคาที่
ซีเอ็นเอ็น รายงานเหตุสะเทือนขวัญและความรุนแรงจากอาวุธปืนในเมืองดัลลัส รัฐเท็กซัส สหรัฐอเมริกา เมื่อเด็กหญิงวัย 14 ปี ทะเลาะกับเพื่อนผู้หญิงอีกคนอย่างรุนแรงจนโมโหและชักปืนขึ้นมายิง แต่กลับพลาดเป้าโดนเด็กชายวัย 11 ขวบที่ไม่เกี่ยวข้อง เสียชีวิตอนาถ
Powered By
ตำรวจเมืองดัลลัสเปิดเผยว่า ได้รับแจ้งเหตุทะเลาะวิวาทและยิงกันบริเวณลานจอดรถของอพาร์ตเมนต์แห่งหนึ่งทางตอนใต้ของเมืองดัลลาส เมื่อช่วงบ่ายวันอาทิตย์ที่ 15 ม.ค.ตามเวลาท้องถิ่น โดยเหตุการณ์ดังกล่าวเกิดขึ้นหลังจากเด็กหญิงสองคนมีปากเสียงและใช้กำลังต่อสู้กัน จากนั้นเด็กหญิงผู้ก่อเหตุหยิบปืนพกที่นำติดตัวไปด้วย และยิงไปทางเด็กหญิงคู่อริ แต่ยิงพลาดถูกเด็กชายที่ยืนดูเหตุการณ์อยู่ไม่ไกลจนเสียชีวิตคาที่เนื่องจากทนพิษบาดแผลไม่ไหว เมื่อเห็นดังนั้นผู้ต้องสงสัยจึงพยายามหลบหนี แต่ไม่นานก็ถูกเจ้าหน้าที่ตำรวจจับกุม พร้อมยึดอาวุธปืนที่ใช้ก่อเหตุเป็นหลักฐาน และตั้งข้อหาฆาตกรรม ก่อนส่งตัวไปยังศูนย์ยุติธรรมเยาวชนเฮนรี เวด เพื่อรอสอบปากคำและดำเนินการสอบสวนต่อไป
The 11-year-old, identified by family as DeEvan McFall, was rushed to a nearby hospital, where he died from his injuries. FOX 4 News DFW
ด้านแม่ของเด็กชายผู้เคราะห์ร้ายกล่าวทั้งน้ำตาว่า ลูกชายชื่อเดเอวาน แมคฟอล เสียชีวิตต่อหน้าต่อตาหลังถูกลูกหลงกระสุนปืนของเด็กหญิงที่ก่อเหตุ และว่าอยากให้คนรุ่นใหม่หยุดคิดก่อนลงมือทำสิ่งที่ไร้เหตุผลแบบนี้ เพราะมีแต่จะสร้างความเจ็บปวดอย่างมากให้กับคนอื่น
ขณะที่โรงเรียนเดโซโต อินดิเพนเดนต์ แถลงแสดงความเสียใจกับครอบครัว และว่า การสูญเสียนักเรียนของโรงเรียนเป็นหนึ่งในประสบการณ์ที่ยากลำบากที่สุด เพราะพวกเขาก็คือลูกๆ ของพวกเรา ด้านครูประจำชั้นของด.ช.เดเอวาน กล่าวว่า เดเอวานเป็นคนน่ารัก ครูและเพื่อนๆ คงจะคิดถึงมากๆ",https://www.khaosod.co.th/around-the-world-news/news_7465853,https://www.khaosod.co.th/wpapp/uploads/2023/01/2-53-300x169.jpg,-
มท.1ยูเครนดับ เซ่นฮ.ตกใกล้รร.อนุบาล-สังเวยเกลื่อนเจ็บอีกระนาว,รอบโลก,"18 ม.ค. 2566
-
16:14 น.","มท.1ยูเครนดับ เซ่นฮ.ตกใกล้รร.อนุบาล-สังเวยเกลื่อนเจ็บอีกระนาว
มท.1ยูเครนดับ  วันที่ 18 ม.ค. เอเอฟพีรายงานว่า เกิดเหตุเฮลิคอปเตอร์ตกในเขตชุมชนทางตะวันออกเฉียงเหนือของกรุงเคียฟ โดยพื้นที่มีทั้งสถานศึกษาระดับชั้นอนุบาล สนามเด็กเล่น และบ้านเรือนประชาชน ส่งผลให้มีผู้เสียชีวิต 16 ราย ในจำนวนนี้ มีเด็กเล็ก 2 ราย และรัฐมนตรีว่าการกระทรวงกิจการภายใน (เทียบเท่ามหาดไทยหรือมท.1) ของยูเครน บาดเจ็บอีก 22 คน เป็นเด็ก 10 คน
Powered By
เหตุเกิดขึ้นที่ย่านโบรวารีซึ่งไม่ใช่แนวหน้าการสู้รบ ส่งผลให้เกิดเพลิงไหม้รุนแรงไปทั่วบริเวณ ยังไม่ทราบสาเหตุที่เครื่องตกแน่ชัด แต่ในจำนวนผู้เสียชีวิตนั้นมีนายเดนิส โมนาสตีร์สกี รมว.กิจการภายในและนายเยฟจีนีฟ เยนิน รมว.ช่วยกิจการภายในด้วย โดยนายโมนาสตีร์สกีเพิ่งได้รับแต่งตั้งเป็นรมว.กิจการภายในเมื่อปี 2565 ที่ผ่านมา
เดนิส โมนาสตีร์สกี รมว.กิจการภายใน (แฟ้มภาพ  เอเอฟพี)
ด้านความคืบหน้าสงครามยูเครน รอยเตอร์รายงานว่า ทางการยูเครนมีแนวโน้มจะได้รับมอบสุดยอดยุทโธปกรณ์ทันสมัยจากชาติตะวันตกเพิ่มเติมในระยะเวลาอันใกล้ อาทิ รถถังลีโอพาร์ด 2 ของเยอรมนี และระบบต่อต้านภัยทางอากาศอย่างขีปนาวุธแพทริออตเพิ่มอีก เพื่อใช้พลิกเกมกวาดล้างกองทัพรัสเซียที่นำกำลังเข้ารุกรานตั้งแต่ 24 ก.พ. 2565
รายงานระบุว่า รถถังลีโอพาร์ด 2 ของเยอรมนีนั้นมีใช้ในหลายชาติราว 20 ประเทศ ถือเป็นหนึ่งในรถถังรุ่นที่มีความทันสมัยที่สุดของชาติตะวันตก มีน้ำหนัก 60 ตัน พร้อมปืนใหญ่ขนาดลำกล้อง 120 มิลลิเมตร พิสัยการยิงไกลถึง 5 กิโลเมตร โดยทางการยูเครนต้องการนำมาใช้ทดแทนรถถังรุ่น ที-72 ซึ่งเป็นรถถังที่ใช้เทคโนโลยีตั้งแต่สมัยอดีตสหภาพโซเวียต
สถานที่เกิดเหตุทางตะวันออกเฉียงเหนือของกรุงเคียฟ เมื่อ 18 ม.ค. (เอเอฟพี)
แนวโน้มความเป็นไปได้ดังกล่าวเกิดขึ้นหลังนายบอริส พิสทอเรียส รัฐมนตรีว่าการกระทรวงกลาโหมคนใหม่ของเยอรมนีเข้ารับตำแหน่งและเตรียมจะพิจารณาคำขอของทางการยูเครน หลังที่ผ่านมาทางการเยอรมนีเป็นชาติยุโรปที่มีท่าทีการส่งมอบความช่วยเหลือทางยุทโธปกรณ์ให้ยูเครนน้อยที่สุด และชาติอื่นซึ่งมีรถถังรุ่นนี้ไม่สามารถส่งมอบให้กับยูเครนได้หากเยอรมนีไม่อนุญาต
ด้านความเคลื่อนไหวที่กรุงวอชิงตัน ประเทศสหรัฐอเมริกา นายมาร์ก รึตเตอ นายกรัฐมนตรีเนเธอร์แลนด์ เปิดเผยกับประธานาธิบดีโจ ไบเดน ผู้นำสหรัฐฯ ว่าเตรียมจะส่งมอบระบบขีปนาวุธแพทริออตให้ยูเครนเพิ่มเติม หลังทางการสหรัฐฯและเยอรมันประกาศจะส่งอาวุธชนิดดังกล่าวให้ยูเครนก่อนหน้านี้
ส่วนความคืบหน้าที่เหตุขีปนาวุธรัสเซียยิงถล่มอพาร์ตเมนต์พลเรือนที่เมืองดนิปรอ ทางภาคตะวันออกของยูเครน มีจำนวนผู้เสียชีวิตเพิ่มเป็น 45 รายแล้ว ในจำนวนนี้ มีเด็ก 6 ราย อายุน้อยที่สุดเพียง 11 เดือน
โดยกองทัพยูเครนและรัสเซียยังคงใช้ปืนใหญ่ยิงถล่มกันไปมาแต่ไม่มีฝ่ายใดส่งกำลังบุกอีกฝ่ายบริเวณนี้ช่วงหลายเดือนที่ผ่านมา ขณะที่กองทัพยูเครนเปิดเผยว่ารัสเซียใช้ปืนใหญ่ยิงถล่มชุมชนกว่า 30 แห่ง ในช่วง 24 ชั่วโมงที่ผ่านมา ในแคว้นลูฮานสก์และโดเนตสก์",https://www.khaosod.co.th/around-the-world-news/news_7465656,https://www.khaosod.co.th/wpapp/uploads/2023/01/%E0%B8%A1%E0%B8%97.1%E0%B8%A2%E0%B8%B9%E0%B9%80%E0%B8%84%E0%B8%A3%E0%B8%99%E0%B8%94%E0%B8%B1%E0%B8%9A-300x169.jpg,-
