Title,Topic,Date,Content,Link,Image,Tag
รถพ่วง22ล้อ บรรทุกเสาเข็ม ยูเทิร์น กระบะพุ่งชนกลางคัน คนขับดับสลด,ทุกทิศทั่วไทย,"19 ม.ค. 2566
-
11:22 น.","รถพ่วง22ล้อ บรรทุกเสาเข็ม ยูเทิร์นจะไปส่งหน้างาน กระบะพุ่งชนกลางคัน รถพังเสียหายยับเยิน คนขับเสียชีวิตคาที่ เจ้าหน้าที่เร่งเข้าทำการตรวจสอบ
เมื่อเวลา 06.00 น. วันที่ 19 ม.ค.2566 ร.ต.อ.หญิง สุดารัตน์ บัวยง รองสารวัตร(สอบสวน) สภ.วิสัยเหนือ รับแจ้งเหตุรถกระบะชนรถบรรทุก บนถนนสายเอเชีย 41 ขาขึ้น กทม. บริเวณจุดกลับรถหน้าปั๊ม ปตท. กม.9 ม.6 ต.ทุ่งคา อ.เมือง จ.ชุมพร จึงรุดไปตรวจสอบพร้อมหน่วยกู้ชีพ กู้ภัยสายชล มูลนิธิชุมพรการกุศลสงเคราะห์ และเจ้าหน้าที่ป้องกันและบรรเทาสาธารณภัย จ.ชุมพร
Powered By
รถพ่วง22ล้อ บรรทุกเสาเข็ม ยูเทิร์นจะไปส่งหน้างาน กระบะพุ่งชนกลางคัน รถพังเสียหายยับเยิน คนขับเสียชีวิตคาที่
ที่เกิดเหตุเจ้าหน้าที่พบรถบรรทุกลากพ่วง 22 ล้อ ยี่ห้อฮีโน่ ส่วนหัวลากทะเบียนป้ายเหลือง 71-6139 สระบุรี ส่วนตัวลากพ่วงทะเบียนป้ายเหลือง 72-4702 สระบุรี บรรทุกเสาเข็มมาจอดขวางอยู่กลางถนน บริเวณจุดกลับรถพอดี คนขับชื่อ นายกฤษกร (ขอสงวนนามสกุล) อายุ 32 ปี ไม่ได้หลบหนีไปไหน โดยยืนรอเจ้าหน้าที่ตำรวจอยู่ในที่เกิดเหตุ
ใกล้กันพบรถกระบะ 4 ประตู ยี่ห้อโตโยต้า ทะเบียน บต2244 ชุมพร สภาพส่วนหลังคารถฉีกขาด อุปกรณ์ชิ้นรถต่าง ๆ พังยับเยินกระเด็นเกลื่อนถนน ส่วนบริเวณเบาะที่นั่งคนขับผู้เสียชีวิตติดอัดอยู่ภายในรถ สภาพเบาะเอนราบลงไปด้านหลัง ผู้เสียชีวิตคาดเข็มขัดนิรภัย ถุงลมตรงพวงมาลัยและด้านข้างทำงาน ทราบชื่อคือ นายอภินันท์ (ขอสงวนนามสกุล) อายุ 53 ปี เจ้าหน้าที่ใช้เครื่องตัดถ่างชิ้นส่วนของรถ ก่อนนำร่างออก สภาพบริเวณหน้ายุบ กะโหลกศีรษะแตก กระดูกซี่โครงหัก
จากการสอบสวน นายกฤษกร ทราบว่า เมื่อเวลา 05.00 น. ตนขับรถบรรทุกเสาเข็ม ซึ่งมีความยาว 22 เมตร จำนวน 5 ต้น จากโรงงาน ซึ่งตั้งอยู่ริมถนนสายเอเชีย 41 ขาขึ้น กทม. และอยู่ห่างจากจุดเกิดเหตุเพียง 300 เมตร เพื่อจะนำไปส่งให้ลูกค้าที่แพลนงานก่อสร้าง ในบ้านมาบอำมฤต ต.ดอนยาง อ.ปะทิว จ.ชุมพร แต่ออกจากโรงงานมาได้ไม่กี่เมตร ยางเกิดรั่ว จึงขับไปกลับรถเพื่อมาปะยางที่ปั๊ม ปตท.
นายกฤษกร กล่าวต่อว่า หลังจากที่ปะยางเป็นที่เรียบร้อย ก็ขับรถออกมาจากปั๊ม และจะต้องกลับรถอีกครั้งที่หน้าปั๊มพอดี เมื่อขับรถออกมาได้ให้สัญญาณไฟขอทางเพื่อจะกลับ ซึ่งรถขาล่องได้หยุดให้ และเมื่อข้ามไปทางฝั่งขาขึ้น รถบรรทุกพ่วงที่วิ่งตามกันขาขึ้น ได้ชะลอและหยุดให้ เพราะเห็นว่าเป็นรถที่บรรทุกสินค้ายาว พอส่วนหัวลากขับจนไปสุดไหล่ทางของถนนขาขึ้น ซึ่งจุดตรงนี้จะกว้างเป็นพิเศษ ส่วนหางยังขวางถนนอยู่
นายกฤษกร กล่าวอีกว่า แต่จู่ ๆ ก็ได้เสียงโครมใหญ่ เมื่อหันไปดูก็พบว่า มีรถกระบะคันดังกล่าว พุ่งชนคันกลางคันระหว่างหัวและหางอย่างแรง จนรถลอดหลุดจอดนิ่ง ตนและชาวบ้าน รวมถึงคนขับรถที่อยู่บริเวณเกิดเหตุ ได้ลงมาเพื่อช่วยเหลือ แต่ก็พบว่าคนขับรถกระบะเสียชีวิตแล้ว ตนจึงได้แจ้งตำรวจมาตรวจสอบดังกล่าว
ผู้สื่อข่าวสอบถามคนขับรถที่จอดอยู่ในที่เกิดเหตุและเห็นเหตุการณ์ ทราบว่า ขณะที่รถบรรทุกพ่วงเสาเข็มกำลังจะกลับรถ ตนและรถคันอื่น ๆ ที่วิ่งตามกันมา ได้ชะลอรถและจอดให้ พร้อมยังเปิดไฟกระพริบขอทางอยู่บนถนนเลนซ้ายสำหรับรถบรรทุก แต่จู่ ๆ ได้มีรถกระบะได้ขับแซงยาวขึ้นมา และก็พุ่งชนอย่างแรงจนเป็นภาพที่เห็นดังกล่าว
เบื้องต้นเจ้าหน้าที่ได้บักทึกเหตุไว้เป็นหลักฐาน ก่อนจะให้ตำรวจทางหลวงได้ช่วยระบายรถขาขึ้น ให้ไปใช้ถนนขาลง โดยให้วิ่งสวนทาง เนื่องจากรถติดเป็นแถวยาวกว่า 1 กิโลเมตร ส่วนคนขับรถพ่วงบรรทุกเสาเข็ม เจ้าหน้าที่ให้นำสินค้าไปส่งให้ลูกค้าก่อน แล้วให้กลับมาให้ปากคำอย่างละเอียดอีกครั้ง เพื่อดำเนินการตามกฎหมายต่อไป",https://www.khaosod.co.th/around-thailand/news_7466493,https://www.khaosod.co.th/wpapp/uploads/2023/01/19-%E0%B8%A3%E0%B8%96%E0%B8%9E%E0%B9%88%E0%B8%A7%E0%B8%8722%E0%B8%A5%E0%B9%89%E0%B8%AD%E0%B8%8A%E0%B8%99%E0%B8%A2%E0%B8%B1%E0%B8%9A-300x169.jpg,-
ฮือฮา! เสือโคร่ง-เสือลายเมฆ โผล่อวดโฉม เตรียมประกาศเขตห้ามล่าสัตว์ป่าศรีสวัสดิ์,ทุกทิศทั่วไทย,"19 ม.ค. 2566
-
11:10 น.","กาญจนบุรี ฮือฮา! พบสัตว์ป่าเพิ่มจำนวน ทั้งเสือโคร่งพันธุ์อินโด ไชนีส เสือลายเมฆ กระทิง พื้นที่เตรียมประกาศ เขตห้ามล่าสัตว์ป่าศรีสวัสดิ์ กองทัพบก-ธนารักษ์ เห็นความสำคัญการอนุรักษ์
19 ม.ค. 66  นายประวุธ เปรมปรีดิ์ หัวหน้าหน่วยควบคุมพื้นที่เตรียมการประกาศเขตห้ามล่าสัตว์ป่าศรีสวัสดิ์ จังหวัดกาญจนบุรี กล่าวว่า พื้นที่ราชพัสดุแปลงหมายเลขทะเบียน ที่ กจ.209 ที่อยู่ในความปกครอง ดูแล และใช้ประโยชน์ของกองพลทหารราบที่ 9 กองทัพบก โดยกรมธนารักษ์ กระทรวงการคลัง เป็นเจ้าของ
Powered By
พื้นที่มีสภาพเป็นภูเขาสูงชัน สลับซับซ้อน และมีป่าไม้ที่อุดมสมบูรณ์ ในพื้นที่ อ.ศรีสวัสดิ์ และอ.บ่อพลอย จ.กาญจนบุรี มีความเหมาะสมที่จะประกาศเป็นเขตห้ามล่าสัตว์ป่าเป็นอย่างยิ่ง
โดยการประกาศเขตห้ามล่าสัตว์ป่านั้น ไม่กระทบต่อสถานะภาพของสถานะที่ดินเดิม ซึ่งผู้ดูแล และใช้ประโยชน์ในที่ดินยังคงมีอำนาจ หน้าที่เช่นเดิม เป็นมาตรการเพิ่มความผิด มีบทลงโทษที่หนักขึ้นกว่าสถานะของที่ดินเดิม
อีกทั้งจะเป็นการเพิ่มเติมเจ้าหน้าที่ของกรมอุทยานแห่งชาติ สัตว์ป่า และพันธุ์พืช ซึ่งมีหน้าที่โดยตรงเข้ามาช่วยดูแลรักษาป่าไม้ สัตว์ป่า และทรัพยากรธรรมชาติที่มีอยู่ เป็นการแบ่งเบาภาระหน้าที่ของฝ่ายทหาร พื้นที่บริเวณดังกล่าวมีเนื้อที่รวมประมาณ 219,000 ไร่
แบ่งเป็น 1. พื้นที่เตรียมการประกาศเขตห้ามล่าสัตว์ป่าศรีสวัสดิ์ ตั้งอยู่ทางทิศใต้ของอุทยานแห่งชาติเขื่อนศรีนครินทร์ เชื่อมกับอุทยานแห่งชาติเฉลิมรัตนโกสินทร์ และเขตรักษาพันธุ์สัตว์ป่าสลักพระ ดังนั้น ถือเป็นเรื่องจำเป็นที่ต้องเชื่อมพื้นที่ดังกล่าวให้เป็นทางเดินของสัตว์ป่า
ซึ่งจะกระจายตัวจากเขตรักษาพันธุ์สัตว์ป่าทุ่งใหญ่นเรศวร  ห้วยขาแข้ง ลงมายังทางใต้ของผืนป่าตะวันตก ในบริเวณพื้นที่เตรียมการประกาศเขตห้ามล่าสัตว์ป่าศรีสวัสดิ์
2. พื้นที่ส่วนขยายเตรียมการประกาศเขตห้ามล่าสัตว์ป่าศรีสวัสดิ์ เดิมพื้นที่ดังกล่าวจะถูกประกาศให้เป็นส่วนขยายของอุทยานแห่งชาติเฉลิมรัตนโกสินทร์ แต่กองทัพบกไม่ยินยอมให้ใช้พื้นที่ และบริเวณนี้พื้นที่ราชพัสดุถูกทับซ้อนด้วยป่าสงวนแห่งชาติ ป่าโรงงานกระดาษไทยแปลงหก กรมป่าไม้
3. พื้นที่เตรียมการประกาศเขตห้ามล่าสัตว์ป่าเขาสลอบ พื้นที่บริเวณนี้เป็นพื้นที่ราชพัสดุแปลงหมายเลขทะเบียน ที่ กจ.209 ประชิดเขตรักษาพันธุ์สัตว์ป่าสลักพระ ซึ่งกองทัพบกใช้ในการฝึกภาคสนาม และมีการลาดตระเวน ตรวจพื้นที่อย่างสม่ำเสมอ แต่การลาดตระเวนดังกล่าวไม่ครอบคลุมการคุ้มครองทรัพยากรธรรมชาติในพื้นที่
โดยเฉพาะทรัพยากรสัตว์ป่า หากพื้นที่บริเวณนี้ได้รับการประกาศเป็นเขตห้ามล่าสัตว์ป่าจะเป็นพื้นที่กันชนให้กับเขตรักษาพันธุ์สัตว์ป่าสลักพระ ซึ่งเป็นพื้นที่ที่มีสัตว์ป่าอาศัยอยู่อย่างชุกชุมได้เป็นอย่างดี
ซึ่งพื้นที่ทั้ง 3 แห่ง อยู่ประชิดกับพื้นที่ป่าอนุรักษ์โดยรอบ จึงมีทรัพยากรสัตว์ป่าอพยพเคลื่อนย้าย และอาศัยอยู่อย่างชุกชุม หากประกาศเป็นเขตห้ามล่าสัตว์ป่า จะมีพระราชบัญญัติสงวนและคุ้มครองสัตว์ป่า พ.ศ.2562 บังคับใช้ ในการคุ้มครองทรัพยากรธรรมชาติ โดยเฉพาะสัตว์ป่าที่หายาก ใกล้สูญพันธุ์ และป่าต้นน้ำลำธาร
อีกทั้ง พื้นที่ทั้ง 3 แห่ง ประสบปัญหาการลักลอบล่าสัตว์ การตัดไม้ การบุกรุกพื้นที่ การเก็บหาของป่า การเลี้ยงปศุสัตว์โดยรอบพื้นที่ และเกิดความขัดแย้งระหว่างมนุษย์กับสัตว์ป่า ได้แก่ ช้างป่า ซึ่งกองทัพบก และกรมธนารักษ์ ไม่ได้มีหน้าที่ภารกิจโดยตรงสำหรับการบริหารจัดการ เรื่องต่างๆ เหล่านี้ และกรมอุทยานแห่งชาติ สัตว์ป่าและพันธุ์พืช ไม่สามารถดำเนินการแก้ไขปัญหาดังกล่าวได้อย่างเต็มที่หากพื้นที่ไม่ได้ประกาศเป็นเขตห้ามล่าสัตว์ป่า
ปัจจุบันจึงมีแผนการดำเนินงานโดยได้รับความร่วมมือ และสนับสนุนงบประมาณจากองค์การภาคเอกชน ได้แก่องค์การ Panthera ประเทศไทย ภายใต้การสนับสนุนจาก Rainforest Trust มูลนิธิสืบนาคะเสถียร WWF ประเทศไทย ZSL ประเทศไทย หวังที่จะปกป้องพื้นที่สามแห่งในผืนป่าตะวันตกทางใต้ เพื่อป้องกันความเสียหายทางระบบนิเวศที่อาจจะเกิดขึ้น และส่งผลกระทบต่อสัตว์ป่าที่อาศัยอยู่ในบริเวณดังกล่าวในอนาคต
โดยจะขออนุญาตใช้พื้นที่ราชพัสดุทั้ง 3 แห่งนี้ให้ได้รับการประกาศเป็นเขตห้ามล่าสัตว์ป่า โดยองค์กรแพนเทอราเอเชียตะวันออกเฉียงใต้และเอเชียใต้ ได้รับทุนสนับสนุนจาก Rainforest Trust ในการดำเนินโครงการ เพื่อสนับสนุนกรมอุทยานแห่งชาติ สัตว์ป่า และพันธุ์พืช ในการดำเนินการประชาสัมพันธ์ ประชุม กับส่วนราชการต่างๆ และชุมชนที่เกี่ยวข้อง จัดจ้างบุคลากร และการก่อสร้างหน่วยพิทักษ์ป่า และจุดสกัด
รวมทั้งสนับสนุนการฝึกอบรมการลาดตระเวนเชิงคุณภาพ (SMART Patrol) การลาดตระเวนเชิงคุณภาพ การฝึกอบรมเจ้าหน้าที่พิทักษ์ป่าเรื่องเทคนิคการติดตั้งกล้องดักถ่ายภาพอัตโนมัติและการบันทึกข้อมูลที่ได้จากการสำรวจ จัดทำเอกสารเผยแพร่ เช่น แผ่นพับ คู่มือ ซื้อรถจักรยานยนต์ 5 คัน สนับสนุนอุปกรณ์สำนักงาน สนับสนุนอุปกรณ์สนาม การลดความขัดแย้งระหว่างคนกับสัตว์ป่าอีกด้วย
หลังจากที่ กองทัพบก และ กรมธนารักษ์ ให้ความสำคัญกับพื้นที่ และยินยอมให้กรมอุทยานแห่งชาติ สัตว์ป่า และพันธุ์พืช เข้าไปช่วยดูแล พบว่า ขณะนี้สัตว์ป่าที่กล้องสามารถจับภาพได้นั้นกำลังมีจำนวนเพิ่มขึ้นและฟื้นตัวกลับมาแล้ว มีทั้ง เสือโคร่งพันธุ์อินโด ไชนีส เสือลายเมฆ กระทิง นายประวุธ เปรมปรีดิ์ หัวหน้าหน่วยควบคุมพื้นที่เตรียมการประกาศเขตห้ามล่าสัตว์ป่าศรีสวัสดิ์ จ.กาญจนบุรี กล่าว",https://www.khaosod.co.th/around-thailand/news_7466471,https://www.khaosod.co.th/wpapp/uploads/2023/01/999-79-300x169.jpg,-
